,index,text,normed_text
8750,10511,cao dang nghe ha nam,Trường Cao Đẳng Nghề Hà Nam
8751,6755,Cao Dang Ky Thuat Khach San Va du Lịch,Trường Cao Đẳng Kỹ Thuật Khách Sạn Và Du Lịch
8752,13994,Trường Trung học Phổ thông Từ Sơn,Trường THPT Dân Lập Từ Sơn
8753,1899,Trường THPT le quy don,Trường THPT Lê Quý Đôn
8754,235, VAA,Học Viện Hàng không
8755,3141,th Trường THCS-THPT yen hung,Trường THCS-THPT Yên Hưng
8756,466,UIFA,Đại Học Mỹ Thuật Công Nghiệp
8757,492,Trường Sĩ Quan Công Binh – Hệ Dân sự,Sĩ Quan Công Binh – Hệ Dân sự
8758,6401,ttgdnn gdtx huyen vinh loi,TT GDNN-GDTX huyện Vĩnh Lợi
8759,3356,Trường THPT kinh mon tu 28 4 2017,Trường THPT Kinh Môn
8760,3483,Trường THPT trung vuong,Trường THPT Trưng Vương
8761,6301,Trường THPT cau ngang a,Trường THPT Cầu Ngang A
8762,650,Đại học Yersin Đà Lạt,Đại học Yersin Đà Lạt
8763,2004,Trường THCS va Trường THPT lac hong,Trường THCS-THPT Lạc Hồng
8764,918,national university of singapore,Đại học Quốc gia Singapore
8765,3435,Trường THPT le quy don,Trường THPT Lê Quý Đôn
8766,1256,nha trang university of fisheries,Đại học Nha Trang
8767,7753,TMTU,Đại học Kỹ thuật Y tế Hải Dương
8768,3567,Trường THPT cao phong,Trường THPT Cao Phong
8769,8705,truog TCN dan toc noi tru tjh tra vjh,Trường TCN DÂN TỘC NỘI TRÚ TRÀ VINH
8770,13854,Trường THPT AN LƯƠNG ĐÔNG,Trường THPT An Lương Đông
8771,13448,Trường THPT le quy don_06,Trường THPT Lê Quý Đôn
8772,6988,Trường THPT ứg h0a A,Trường THPT Ứng Hòa A
8773,3305,Trường THPT thuan thanh so 1,Trường THPT Thuận Thành số 1
8774,10477,Trường THPT Cao Thắng,Trường THPT Cao Thắng
8775,11258,Trường Đại học Xây dựng,Trường Đại Học Xây Dựng
8776,14424,Truong Trường THPT Dan Toc noi tru tinh lao cai,Trường THPT Dân tộc Nội trú Lào Cai
8777,5885,cd nghe quoc te hong lam,CĐ nghề quốc tế Hồng Lam
8778,1295,cao dang kinh te_ ky thuat phu lam q6,Cao Đẳng Kinh tế - Kỹ thuật Phú Lâm
8779,12892,Kinh tê ki thuat daklak,Trường Trung Cấp Đắk Lắk - Cơ sở 1
8780,3058,TT GDTX phuc yen truoc nam 2015,TT GDTX Phúc Yên
8781,3495,trung cap cong nghe kinh te viet han,"Trung cấp Công nghệ, Kinh tế Việt Hàn"
8782,3038,TT GDTX yen lac truoc nam 2015,TT GDTX Yên Lạc
8783,11367,Trường THPT số 1 Tư Nghĩa - Tư nghĩa - Quãng ngãi,Trường THPT số 1 Tư Nghĩa
8784,3181,Trường THPT nguyen hong,Trường THPT Nguyên Hồng
8785,2062,Trường THCS va Trường THPT nhan van,Trường THCS-THPT Nhân Văn
8786,14559,TRUONG Trường THPT QUANG XUONG 4,Trường Trường THPT Quảng Xương 4
8787,14155,"Dai hoc ba ria, Vung Tau",Trường Đại học Bà Rịa - Vũng Tàu
8788,740,Đại Học Kỹ Thuật - Hậu Cần Công An Nhân Dân ( Phía Nam ),Đại Học Kỹ Thuật - Hậu Cần Công An Nhân Dân 
8789,5260,Trường THPT long hoa,Trường THPT Long Hòa
8790,4207,trung tam dn hn va gdtx ky anh,TT DN-HN và GDTX Kỳ Anh
8791,8993,Trường CĐ VHNT Việt Bắc,Trường Cao Đẳng Văn hóa Nghệ thuật Việt Bắc
8792,12857,Cao dang say dung,Trường Cao Đẳng Xây dựng Số 1
8793,13349,Trường THPT Tên Du 1,Trường THPT Tiên Du 1
8794,83,HV Bưu Chính Viễn Thông,Học Viện Công Nghệ Bưu Chính Viễn Thông
8795,4653,phong gd dt huyen kon ray,Phòng GD-ĐT huyện Kon Rẫy
8796,446,Đại Học Sư Phạm Kỹ Thuật Nam Định,Đại Học Sư Phạm Kỹ Thuật Nam Định
8797,4608,cd kinh te ky thuat kon tum,CĐ Kinh tế - Kỹ thuật Kon Tum
8798,13879,CD Ky Thuat CT,Trường Cao Đẳng Kinh tế - Kỹ thuật Cần Thơ
8799,6552,Trường THPT tran hung dao,Trường THPT Trần Hưng Đạo
8800,2097,btvh thanh da,BTVH Thanh Đa
8801,3920,Trường THPT nong cong 2,Trường THPT Nông Cống 2
8802,8186,Trường sĩ quan công binh - Thủ Dầu Một - Bình Dương,Trường Sĩ quan Công binh
8803,7089,Trung cấp Lâm Ngiệp,Trung Cấp Lâm Nghiệp Tây Nguyên
8804,9198,Truong noi tru bac quang ha giang,Trường THPT Dân Tộc Nội Trú Cấp 2- 3 Bắc Quang
8805,6374,trung tam day nghe va gdtx huyen nga nam,TT dạy nghề và GDTX huyện Ngã Năm
8806,4049,tc nghe ky thuat cong nong nghiep yen thanh,TC Nghề Kỹ thuật Công - Nông nghiệp Yên Thành
8807,9527,Trường THPT Cư M'gar,Trường THPT Cư M'Gar
8808,5922,Trường THPT luu tan phat,Trường THPT Lưu Tấn Phát
8809,5881,TT GDTX tan thanh truoc 12 4 2018,TT GDTX Tân Thành
8810,12755,Trường THPT Nam Ninh A,Trường THPT Trực Ninh A
8811,13528,HPU,Đại học Quản lý và Công nghệ Hải Phòng
8812,9895,Trường THPT Chu Văn An - Bình Định,Trường THPT chuyên Chu Văn An
8813,8872,PTTH Chuyên Cao Bằng,Trường THPT Chuyên Cao Bằng
8814,9621,Trường THPT Lưu Nhân Chú,Trường THPT Lưu Nhân Chú
8815,6734,"Trường THPTTH Phú Mỹ, Tân Thành, BRVT",Trường THPT Phú Mỹ
8816,4262,Trường THPT nguyen huu canh truoc 2019 khu vuc uu tien la kv1,Trường THPT Nguyễn Hữu Cảnh
8817,5594,Trường THPT nguyen huu tho,Trường THPT Nguyễn Hữu Thọ
8818,1651,gdtx dong my,GDTX Đông Mỹ
8819,6529,trung tam gdnn gdtx huyen muong nhe,TT GDNN-GDTX huyện Mường Nhé
8820,13857,le quy don dong da ha noi,Trường THPT Lê Quý Đôn
8821,10609,truong trung hoc pho thong kien hai,Trường Trường THPT Kiên Hải
8822,7724,Trường trung học phổ thông Nguyễn Mộng Tuân,Trường THPT Nguyễn Mộng Tuân
8823,3109,trung tam gdnn gdtx mongcai,TT GDNN-GDTX MóngCái
8824,5273,Trường THPT nguyen an ninh tu 01 02 2020,Trường THPT Nguyễn An Ninh
8825,8885,Trường THPTTH Lê Thị Riêng,Trường THPT Lê Thị Riêng
8826,7691,Truong trung hoc pt yd 2,Trường THPT Yên Dũng số 2
8827,476,Học Viện Hậu Cần - Hệ Dân sự,Học Viện Hậu Cần - Hệ Dân sự
8828,4918,truong trung cap truong son,Trường Trung cấp Trường Sơn
8829,10058,pho thong vo minh duc,Trường THPT Võ Minh Đức
8830,4705,tt gdnn gdtx phu my,TT GDNN-GDTX Phù Mỹ
8831,3326,Trường THPT hong quang,Trường THPT Hồng Quang
8832,11585,Trường THPT sông đốc,Trường THPT Sông Đốc
8833,9815,pho thong trung hoc ham thuan nam,Trường THPT Lương Thế Vinh
8834,3250,Trường THPT tu thuc thai son,Trường THPT tư thục Thái Sơn
8835,10629,truong cong thuong,Trường Cao Đẳng Công Thương Hà Nội
8836,7731,Cao dang su fam tw,Trường Cao Đẳng Sư phạm Trung ương
8837,7556,Dai hoc n0ng ngkiep,Học viện Nông nghiệp Việt Nam
8838,4248,Trường THCS va Trường THPT viet trung,Trường THCS-THPT Việt Trung
8839,9489,ĐH Bách Khoa Hà Nội,Trường Đại học Bách khoa Hà Nội
8840,5659,Trường THPT lap vo 1,Trường THPT Lấp Vò 1
8841,4124,Trường THPT chuyen ha tinh,Trường THPT Chuyên Hà Tĩnh
8842,1460,dai hoc khoa hoc xa hoi va nhan van co so linh trung,Đại học Khoa học Xã hội và Nhân văn – Đại học Quốc gia TP.HCM
8843,12419,Cao dang nong nghiep w1,Trường Cao Đẳng Nông Nghiệp Và Phát Triển Nông Thôn Bắc Bộ
8844,9454,Trường THPT vỉnh linh,Trường THPT Vĩnh Linh
8845,3613,quan nhan cong an tai ngu_25,"Quân nhân, Công an tại ngũ_25"
8846,10902,"Trường THCS Vĩnh Bình Gò Công Tây , Tiền Giang",Trường Trung Học Cở Sở Vĩnh Bình
8847,13334,Trường TT GDTX tân phú,TT GDTX quận Tân Phú
8848,14053,"THPH Nguyễn Huệ, Bình Phước",Trường THPT Nguyễn Huệ
8849,13123,Trường THCS-THPT Bắc Sơn,Trường THPT Bắc Sơn
8850,781,Đại Học Thể Dục Thể Thao Bắc Ninh,Đại Học Thể Dục Thể Thao Bắc Ninh
8851,4355,Trường THPT nguyen hue,Trường THPT Nguyễn Huệ
8852,8461,Cao Đẳng KT - KT TP HCM,Trường Cao Đẳng Kinh tế Kỹ thuật TP.HCM
8853,9898,"Trường THPT  Chuyên Vị Thanh, Vị Thanh, Hậu Giang",Trường THPT Chuyên Vị Thanh
8854,1881,Trường THPT chuyen tran dai nghia,Trường THPT chuyên Trần Đại Nghĩa
8855,9593,Đại học Kinh tế và quản trị kinh doanh Thái Nguyên,Trường Đại học Kinh tế và Quản trị kinh doanh - Đại học Thái Nguyên
8856,4826,tt gdtx phu thien,TT GDTX Phú Thiện
8857,4984,gdtx hn nha trang,GDTX-HN Nha Trang
8858,7100,thph quế võ 3,Trường THPT Quế Võ số 3
8859,404,HOU,Viện Đại Học Mở Hà Nội
8860,10502,truong Trường THPT phan chu trinh,Trường THPT Phan Chu Trinh
8861,4333,Trường THPT bui duc tai,Trường THPT Bùi Dục Tài
8862,7869,truong trung hoc pho thong vinh binh,Trường THPT Vĩnh Bình
8863,13611,Học viện Quân Khu 3,Trường Quân Sự Quân Khu 3
8864,12638,truong Trường THPT phu luong,Trường THPT Phú Lương
8865,11534,Trường 600,Trường Sỹ Quan Tăng Thiết Giáp
8866,12532,dai hoc cntt va truyen thong,Trường Đại học Công nghệ Thông tin & Truyền thông Thái Nguyên
8867,145, HUP,Đại Học Dược Hà Nội
8868,12255,Truog trug hok co so mj ha,Trường THCS̉ Xã Mỹ Hà
8869,8307,Trường THPT Hùng Vương - Đức Linh - Bình Thuận,Trường Trường THPT Hùng Vương
8870,11822,DH kỹ thuật y dược Đà Nẵng,Trường Đại học Kỹ thuật Y - Dược Đà Nẵng
8871,1750,gdnn gdtx huyen thach that,GDNN-GDTX huyện Thạch Thất
8872,7994,Truong Trường THPT Long Binh,Trường THPT Long Bình
8873,13650,"Trường THPT Thái Phiên, Đà Nẵng",Trường THPT Thái Phiên
8874,12993,Trường THPT Thuận Thành 1,Trường THPT Thuận Thành số 1
8875,3869,Trường THPT nhu xuan,Trường THPT Như Xuân
8876,13126,TTrường THPT Phụ Dục,Trường THPT Phụ Dực
8877,3905,Trường THPT thieu hoa,Trường THPT Thiệu Hoá
8878,5427,Trường THPT le hong phong,Trường THPT Lê Hồng Phong
8879,13265,Trường THPT Phước Long _ Q9 _TP HCM,Trường THPT Phước Long
8880,11477,Trường THPT Hoang Diệu,Trường THPT Hoàng Diệu
8881,961,hoc vien ky thuat quan su (mta),Học viện Kỹ thuật Quân sự
8882,7852,Trung hoc pt Muong La,Trường THPT Mường La
8883,3525,Trường THPT da bac,Trường THPT Đà Bắc
8884,9881,Đại học Y Hue,Trường Đại học Y Dược Huế
8885,620,Đại học Kỹ Thuật Công Nghệ Cần Thơ,Đại học Kỹ Thuật Công Nghệ Cần Thơ
8886,5876,Trường THPT vo thi sau con dao,Trường THPT Võ Thị Sáu - Côn Đảo
8887,4114,TT GDTX thai hoa,TT GDTX Thái Hòa
8888,12449,Trường THPT Võ Thị Sáu,Trường THPT Võ Thị Sáu
8889,4318,Trường THPT tan lam den 23 02 2020,Trường THPT Tân Lâm 
8890,11876,CAO DANG MUA VIET NAM,Học viện Múa Việt Nam
8891,5488,Trường THPT long khanh,Trường THPT Long Khánh
8892,5406,Trường THPT chu van an,Trường THPT Chu Văn An
8893,6105,phong gd dt q o mon,Phòng GD-ĐT Q.Ô Môn
8894,10682,HUBT university'09,Trường Đại học Kinh doanh và Công nghệ Hà Nội
8895,4456,Trường THPT le hong phong,Trường THPT Lê Hồng Phong
8896,67, UNRE,Đại Học Tài nguyên và Môi Trường
8897,4226,Trường THCS va Trường THPT bac son,Trường THCS-THPT Bắc Sơn
8898,14241,Truong PTTH -Quang Trung -Hai Duong,Trường THPT Trung Văn
8899,418,SDU,Đại học Sao Đỏ
8900,583,Đại Học Quảng Nam,Đại Học Quảng Nam
8901,4793,truong Trường THPT tran phu,Trường THPT Trần Phú
8902,1926,Trường THPT tan nam my,Trường THPT Tân Nam Mỹ
8903,9251,dai hock Bach's Khoa ha noi,Trường Đại học Bách khoa Hà Nội
8904,13423,truong Trường THPT my duc c,Trường THPT Mỹ Đức C
8905,12759,trung cấp csnd 6,Trường Trung Cấp Cảnh Sát Nhân Dân 6
8906,1424,university of pharmacy and medicine at hochiminh city,Đại học Y Dược TP.HCM
8907,9176,Trường THCS va Trường THPT Tan Thanh,Trường THCS-THPT Tân Thạnh
8908,561,Đại Học Dược Hà Nội,Đại Học Dược Hà Nội
8909,8714,Nguyen Huu Canh - Cho Moi,Trường THPT Nguyễn Hữu Cảnh
8910,11018,Dai hoc dan lap Lac Hong,Trường đại Học Lạc Hồng 
8911,9193,Trường Cao Đẳng Nghề Kinh Tế - Công Nghệ VICET,Trường Cao Đẳng Nghề Kinh Tế Công Nghệ VICET
8912,1643,tc nghe giao thong cong chinh ha noi,TC nghề Giao thông Công chính Hà Nội
8913,6066,truong tc mien tay,Trường TC Miền Tây
8914,4111,Trường THPT thai hoa,Trường THPT Thái Hoà
8915,6819,PTTH trần hưng đạo,Trường THPT Trần Hưng Đạo
8916,10092,"Trường THPT Thiệu Hoá, Thiệu Hoá, Thanh Hoá",Trường THPT Thiệu Hoá
8917,3445,cao dang nghe co dien va thuy loi,Cao Đẳng Nghề Cơ điện và Thủy lợi
8918,6716,CĐ Su Pham BR_VT,Trường Cao Đẳng Sư phạm Bà Rịa Vũng Tàu
8919,10199,University of Sicence,"Trường Đại học Khoa học Tự nhiên, Đại học Quốc gia Hà Nội "
8920,10927,Giong Ong To Hghschool,Trường THPT Giồng Ông Tố
8921,11896,Trường THPT YenLang,Trường THPT Yên Lãng
8922,5660,Trường THPT lap vo 2,Trường THPT Lấp Vò 2
8923,1878,quan nhan cong an tai ngu_02,"Quân nhân, Công an tại ngũ_02"
8924,62,HV Nông Nghiệp Việt Nam,Học Viện Nông Nghiệp Việt Nam
8925,9514,Trường Trung Cấp Cảnh Sát Nhân Dân 3 - 71 CMT8,Trường Đại học cảnh sát nhân dân cơ sở 3
8926,85, PTIT,Học Viện Công Nghệ Bưu Chính Viễn Thông
8927,442,VUTED,Đại học Sư phạm Kỹ thuật Vinh
8928,2633,cd cong nghe va nong lam dong bac,CĐ Công nghệ và Nông lâm Đông Bắc
8929,12851,Yên Khánh A,Trường THPT Yên Khánh A
8930,14464,CD nghề Du Lịch Vũng Tàu,Trường Cao Đẳng Du lịch Vũng Tàu
8931,4523,ptdtnt huyen phuoc son,PTDTNT huyện Phước Sơn
8932,9676,Trường THPT Phan Đăng Lưu ( Nghệ An ),Trường Trường THPT Phan Đăng Lưu
8933,11843,"Nguyen Trai, Bien Hoa",Trường THPT Nguyễn Trãi
8934,4132,trung tam gdnn gdtx hong linh,TT GDNN-GDTX Hồng Lĩnh
8935,4051,Trường THPT dien chau 3,Trường THPT Diễn Châu 3
8936,7799,Dan toc Noi tru Vinh Long,Trường THPT Dân tộc nội trú Vĩnh Long
8937,8717,phổ thông chi lăng,Trường THPT Chi Lăng
8938,13277,TTrường THPT thixa phuoc long,Trường THPT Thị Xã Phước Long
8939,10099,trung hoc pt tran phu,Trường THPT Trần Phú
8940,2405,Trường THPT bang ca,Trường THPT Bằng Ca
8941,13498,Phổ Thông Kim Sơn B,Trường THPT Kim Sơn B
8942,1277,trung cap dien cong nghiep va xay dung fico,Trung Cấp Nghề Công Nghiệp Và Xây Dựng Fico
8943,3781,Trường THPT ngo thi nham,Trường THPT Ngô Thì Nhậm
8944,7534,trung học phổ thông Chu Văn An,Trường THPT Chu Văn An 
8945,2662,tt gdtx h ba be tinh bac kan,TT GDTX H. Ba Bể tỉnh Bắc Kạn
8946,5992,Trường THPT phan thi rang,Trường THPT Phan Thị Ràng
8947,14148,PTHH Hà Huy Tập,Trường THPT Hà Huy Tập
8948,11923,dai học sư phạm,Trường Đại học Sư phạm Hà Nội
8949,9172,Việt Đức High School,Trường THPT Việt Đức
8950,3637,Trường THPT tran van lan,Trường THPT Trần Văn Lan
8951,6076,cd kinh te ky thuat can tho,CĐ Kinh tế - Kỹ thuật Cần Thơ
8952,6001,trung tam gdnn gdtx huyen tan hiep,TT GDNN-GDTX huyện Tân Hiệp
8953,1617,tc nghe so 17,TC nghề số 17
8954,1339,cao dang nghe so5,Cao Đẳng Nghề Số 5
8955,3748,Trường THPT chu van an,Trường THPT Chu Văn An
8956,12976,Trường THPT nghiloc 5,Trường THPT Nghi Lộc 5
8957,7067,"PTTH Tuy Phước 2, 1994",Trường THPT Số 2 Tuy Phước
8958,9303,Phổ thông trung học Huỳnh Thúc Kháng,Trường THPT Huỳnh Thúc Kháng
8959,12828,12A4 Trường THPT Tran Dang Ninh,Trường THPT Trần Đăng Ninh
8960,5151,Trường THPT nguyen du,Trường THPT Nguyễn Du
8961,4006,Trường THPT quy hop 2,Trường THPT Quỳ Hợp 2
8962,1150,dh khtn tphcm,Đại học Khoa học Tự nhiên - Đại học Quốc Gia TP.HCM
8963,4117,Trường THPT hoang mai 2,Trường THPT Hoàng Mai 2
8964,2865,trung tam gdtx huyen phu yen,TT GDTX huyện Phù Yên
8965,11132,Trường THPT Quỳ Hợp 3,Trường THPT Quỳ Hợp 3
8966,885,bo mon luat dai hoc khoa hoc thai nguyen,Đại học Khoa học Thái Nguyên
8967,5474,th Trường THCS-THPT le quy don tan phu,Trường THCS-THPT Lê Quý Đôn-Tân Phú
8968,1510,cd nghe hung vuong,CĐ nghề Hùng Vương
8969,3480,th Trường THCS va Trường THPT hong duc,Trường THCS-THPT Hồng Đức
8970,13758,trung hoc pho thong yen khe,Trường THPT nhữ khê
8971,9901,Daj hok xa hoj,Trường Đại học Khoa học Xã hội và Nhân văn - Đại học Quốc gia Hà Nội
8972,1361,cdkt vinhempich,Sĩ quan Kỹ thuật Quân sự Vinhempich
8973,13317,Viện ĐH Mở HN,Trường Đại học Mở Hà Nội
8974,10472,Đại hoc kinh kế quốc quốc dân,Trường Đại Học Kinh Tế Quốc Dân
8975,8473,Trường THPT amsterdam,Trường THPT chuyên Hà Nội - Amsterdam
8976,9832,Trường Trung cấp kinh tế kỹ thuật Hà Giang,Trường Kinh tế Kỹ thuật Hà Giang
8977,7742,Vietnam Women's Academy,Học Viện Phụ Nữ Việt Nam
8978,1192,dhkt,Đại học Kinh tế – Đại Học Quốc Gia Hà Nội
8979,1637,Trường THPT tay do,Trường THPT Tây Đô
8980,2762,cd cong nghe va kinh te cong nghiep,CĐ Công nghệ và Kinh tế Công nghiệp
8981,4136,trung tam dn hn va gdtx hong linh,TT DN-HN và GDTX Hồng Lĩnh
8982,6690,TT GDTX Quỳnh Phụ II,TT GDTX 2 Quỳnh Phụ
8983,5854,tc cong nghe thong tin tm computer,TC Công nghệ thông tin TM. COMPUTER
8984,2061,Trường THCS-THPT hong duc,Trường THCS-THPT Hồng Đức
8985,12291,Trường THPT Lê Hoài Đôn,Trường THPT Lê Hoài Đôn
8986,4533,truong Trường THPT tran ky phong,Trường THPT Trần Kỳ Phong
8987,12736,Trường THPT Võ Văn Kiệt,Trường THPT Võ Văn Kiệt
8988,8415,dai hoc ktkt binh duong,Trường Đại học Kinh tế - Kỹ Thuật Bình Dương
8989,11575,cd su pham quangtri,Trường Cao Đẳng sư phạm Quảng Trị
8990,10057,Học Viện Đường Sắt - Cao Đẳng Nghề Đường Sắt Gia Lâm - Hà Nội,Trường Cao Đẳng Đường sắt
8991,10990,hoc dai hoc tu do,Trường Đại học Thủ đô Hà Nội
8992,12980,Truong PHPT Vinh Bao,Trường Trường THPT Vĩnh Bảo
8993,8851,Trường Mầm Non Hoa Hồng  phu thjen,Trường mầm non Hoa Hồng
8994,2967,truong Trường THPT thanh son,Trường THPT Thanh Sơn
8995,11774,CĐ kinh tế kĩ thuật Kiên Giang,Trường Cao Đẳng Kinh Tế Kỹ Thuật Kiên Giang
8996,8424,Phan Ngoc tong,Trường THPT Phan Ngọc Tòng
8997,5368,Trường THPT nguyen trai tu 01 02 2020,Trường THPT Nguyễn Trãi
8998,2801,Trường THCS-THPT pung luong,Trường THCS-THPT Púng Luông
8999,14175,Cao Đẳng Công Nghệ Thông Tin Việt - Hàn,Trường Đại học Công nghệ Thông tin và Truyền thông Việt - Hàn
9000,6877,PTTH HOÀNG HOA THÁM - TP ĐÀ NẴNG,Trường THPT Hoàng Hoa Thám
9001,9673,Trường Đại học Tiền Giang,Trường Đại học Tiền Giang
9002,9566,PTDT Nội trú tân kỳ,Trường THPT Dân tộc Nội trú Tân Kỳ
9003,11462,Trường THPT hjên đa,Trường THPT Hiền Đa
9004,2506,cao dang su pham lao cai,Cao Đẳng Sư Phạm Lào Cai
9005,8996,TRUONG TRUNG HOC PHO THONG TRAN AN CHIEM,Trường THPT Trần Ân Chiêm
9006,11640,Trường Bách Khoa trung Cấp 70-73 nay lầ Đai học Bach Khoa,Trường Đại học Bách khoa Hà Nội
9007,14029,Trường Cao Đẳng Dược Hà Nội,Trường Cao Đẳng Y Dược Pasteur Hà Nội
9008,10685,Truong TCCN binh duong,Trường Trung Cấp Công Nghiệp Bình Dương
9009,3543,trung tam gdnn gdtx huyen luong son,TT GDNN-GDTX huyện Lương Sơn
9010,11082,Phổ thông Phan Đình Phùng,Trường THPT Phan Đình Phùng
9011,2102,Trường THPT han thuyen,Trường THPT Hàn Thuyên
9012,13827,Trường trung học phổ thông Kim Xuyên,Trường THPT Kim Xuyên
9013,12768,CẤP 3 QUẾ SƠN,Trường cấp 3 quế sơn
9014,11196,ĐH YD TN,Đại học Y Dược Thái Nguyên
9015,2408,Trường THPT ly bon,Trường THPT Lý Bôn
9016,2543,tt gdnn gdtx thi xa sa pa,TT GDNN-GDTX thị xã Sa Pa
9017,4301,phong gd dt vinh linh,Phòng GD-ĐT Vĩnh Linh
9018,2174,Trường THPT hong bang,Trường THPT Hồng Bàng
9019,4442,truong cd y te quang nam,Trường CĐ Y tế Quảng Nam
9020,1242,hatinh university vietnam,Đại học Hà Tĩnh
9021,12091,trung cấp y tế gia lai,Trường Trung cấp Y tế Gia Lai
9022,14482,Trường THPT Vĩnh Bảo,Trường Trường THPT Vĩnh Bảo
9023,5413,tt gdtx hn tanh linh,TT GDTX-HN Tánh Linh
9024,10245,CĐ Hồng Cẩm,Cao Đẳng Nghề Mỏ Hồng Cẩm
9025,10375,cao dang tai chinh qauan tri kinh doanh,Trường Cao Đẳng Tài Chính - Quản Trị Kinh Doanh
9026,1186,cao dang bach khoa ha noi,Cao Đẳng Bách Khoa Hà Nội
9027,11829,"Trường THPT Thu Khoa Nghia,Chau Dok, An Giang, Viet Nam",Trường THPT Chuyên Thủ Khoa Nghĩa
9028,4472,truong cd cong ky nghe dong a,Trường CĐ Công kỹ nghệ Đông Á
9029,795,Đại học Hòa Bình,Đại học Hòa Bình
9030,4758,truong tc nghe so 21,Trường TC nghề số 21
9031,12809,buôn ma thuộc,Thành phố Buôn Ma Thuột
9032,12617,Trường THPT Nguyễn Đình Chiểu - An Nhơn - Bình Định,Trường THPT Nguyễn Đình Chiểu
9033,1398,ho chi minh city university of enocomics,Đại học Kinh tế TP.HCM
9034,8185,Học Viện Chính trị - Hành chính Quốc gia Hồ Chí Minh,Học viện Chính trị Quốc gia Hồ Chí Minh
9035,506,ĐH,Đại học Thành Đô
9036,4843,dai hoc xay dung mien trung,Đại học Xây dựng Miền Trung
9037,4593,truong Trường THPT tra bong,Trường THPT Trà Bồng
9038,3706,tt gdtx h hai hau,TT GDTX H. Hải Hậu
9039,5958,truong tc nghe khu vuc cai lay,Trường TC Nghề Khu vực Cai Lậy
9040,8503,Trung học PT Lê Doãn Nhã,Trường THPT Lê Doãn Nhã
9041,13471,dh ktyt hai duong,Đại học Kỹ thuật Y tế Hải Dương
9042,9853,Truong Trường THPT Côn Tiên,Trường THPT Cồn Tiên
9043,12574,nội trú bắc giang,Trường THPT Dân Tộc Nội Trú Tỉnh Bắc Giang
9044,5403,Trường THPT ham tan,Trường THPT Hàm Tân
9045,4324,Trường THCS-THPT tan lam,Trường THCS-THPT Tân Lâm
9046,10343,truong Trường THPT Ha Long,Trường THPT Hạ Long
9047,6495,truong Trường THPT thi xa muong lay,Trường THPT thị xã Mường Lay
9048,215,ĐH Tôn Đức Thắng,Đại Học Tôn Đức Thắng
9049,7858,Truong Trường THPT TAN HIEP,Trường THPT Tân Hiệp
9050,71,ĐH Công nghiệp HN,Đại Học Công nghiệp Hà Nội
9051,307,QNAMUNI,Đại Học Quảng Nam
9052,12392,Caodangbachkhoadanang,Trường Cao Đẳng Bách Khoa Đà Nẵng
9053,3004,Trường THPT vinh yen,Trường THPT Vĩnh Yên
9054,10268,Trường THPT BC DINH QUAN,Trường THPT Định Quán
9055,2904,phong gd dt huyen van ho,Phòng GD - ĐT huyện Vân Hồ
9056,1787,tc nghe nhan luc quoc te,TC nghề Nhân lực Quốc tế
9057,979,"hoc vien an ninh, hoc vien canh sat, dai hoc pccc",Học Viện An ninh Nhân Dân
9058,14084,Truong cao dang nghe cong nghiep ha noi,Trường Cao Đẳng nghề Công nghiệp Hà Nội
9059,13219,"Trường THPT Phước Vĩnh, Phú Giáo, Bình Dương",Trường THPT Phước Vĩnh
9060,14314,"van hoa nghe thuat nha trang, khanh hoa",Trường Cao Đẳng Văn Hóa Nghệ Thuật Du Lịch Nha Trang
9061,243, National Academy of Public Administration ,Học viện Hành chính Quốc gia
9062,10709,THPH ĐÔNG HÀ,Trường THPT Đông Hà
9063,5946,trung tam gdtx hn go cong dong,TT GDTX HN Gò Công Đông
9064,9697,Phổ Thông Cấp 2-3 Tân Lập,Trường THPT Tân Lập
9065,3997,tran dai nghia,Trần Đại Nghĩa
9066,422,Đại Học Kinh Tế – Đại Học Đà Nẵng,Đại Học Kinh Tế – Đại Học Đà Nẵng
9067,10975,Trung học phổ thông Trưng Vương,Trường THPT Trưng Vương
9068,3546,Trường THPT nam luong son,Trường THPT Nam Lương Sơn
9069,7682,trung học phổ thông giao thủy b,Trường THPT Giao Thủy B
9070,7845,Trường THPTTH DL Hùng Vương,Trường THPT Hùng Vương
9071,13771,DH Nguyen Tat Thanh TPHCM,Trường Đại học Nguyễn Tất Thành
9072,10665,Trung cấp Phật học Đà nẵng,Trường Trung cấp Phật học
9073,14480,Giong Ong To Highschool,Trường THPT Giồng Ông Tố
9074,9582,Truong Trường THPT Vo Van Kiet,Trường THPT Võ Văn Kiệt
9075,8360,PT Vĩnh lộc,Trường THPT VĨNH LỘC
9076,842,cd kinh te ky thuat dien bien,Cao Đẳng Kinh Tế - Kỹ Thuật Điện Biên
9077,479,NAEM,Học Viện Quản Lý Giáo Dục
9078,11466,Trường THPT pham van dong eana krôngana daklak,Trường THPT Phạm Văn Đồng
9079,3592,Trường THPT dan lap tran hung dao,Trường THPT Dân lập Trần Hưng Đạo
9080,6520,trung tam gdnn gdtx huyen tua chua,TT GDNN-GDTX huyện Tủa Chùa
9081,6578,pho thong dtnt Trường THCS-THPT huyen tuy duc,Trường THPT DTNT Trường THCS-THPT huyện Tuy Đức
9082,12431,HCMC University of Economics - Đại học Kinh tế Thành phố Hồ...,Trường Đại học Kinh tế TP.HCM
9083,1054,cao dang su pham yen bai,Cao Đẳng Sư Phạm Yên Bái
9084,3836,Trường THPT chuyen lam son,Trường THPT Chuyên Lam Sơn
9085,1889,tt gdnn va gdtx quan 1,TT GDNN-GDTX Quận 1
9086,6802,Trường THPT Chuyên Thái Nguyên,Trường THPT Chuyên Thái Nguyên
