,index,text,normed_text
5725,12195,Trường THPT Thạch Thành 2,Trường THPT Thạch Thành II
5726,1590,Trường THPT ho xuan huong,Trường THPT Hồ Xuân Hương
5727,9884,Trường THPT Chu Văn An,Trường THPT Chu Văn An 
5728,3342,tt gdnn gdtx chi linh,TT GDNN-GDTX Chí Linh
5729,12775,"Trường THPT Nguyen Hien,Da Nang,Viet Nam",Trường THPT Nguyễn Hiền
5730,7912,bán công quỳnh phụ,Trường THPT Bán công huyện Quỳnh Phụ
5731,2731,TT GDTX huyen vo nhai,TT GDTX Huyện Võ Nhai
5732,8843,TRUONG Trường THPT TINH GIA 3,Trường THPT Tĩnh Gia 3
5733,10175,Trần Ngọc Hoằng,Trường THCS-THPT Trần Ngọc Hoằng - H.Cờ Đỏ
5734,6053,so gd dt can tho,Sở GD-ĐT Cần Thơ
5735,7644,Trường trung học phổ thông lương phú,Trường THPT Lương Phú
5736,1888,th Trường THCS va Trường THPT uc chau,Trường THCS-THPT úc Châu
5737,3190,Trường THPT luc ngan so 4,Trường THPT Lục Ngạn số 4
5738,13546,TTrường THPT Chiem Thanh Tan,Trường THPT Chiêm Thành Tấn
5739,7835,Trường THPT Vân Khánh,Trường THPT Vân Khánh
5740,10792,truongcaodangtruyenhinh,Trường Cao Đẳng Truyền hình
5741,11031,Trung cấp KT- KT Nguyễn Hữu Cảnh,Trường Trung cấp Kinh tế - Kỹ thuật Nguyễn Hữu Cảnh
5742,327,TVU,Đại học Trưng Vương
5743,8478,Trường Bách Khoa Bình Dương,Trường Trung Cấp Bách Khoa Bình Dương
5744,12364,Đại Học Tây Đô,Trường Đại Học Tây Đô
5745,10181,Trường THPT Chuyên Sơn La,Trường THPT Chuyên Sơn La
5746,13320,Trường THPTTH Kiến An,Trường THPT Kiến An
5747,11324,Trường THPT Nghi Lộc3,Trường THPT Nghi Lộc 3
5748,13563,"Trường chuyên Lê Quý Đôn, Quy Nhơn, Bình Định",Trường THPT chuyên Lê Quý Đôn Bình Định
5749,3848,tc nghe bim son,TC nghề Bỉm Sơn
5750,2782,pt dtnt Trường THPT mien tay,Trường THPT DTNT Trường THPT Miền Tây
5751,11339,Trường THPT Nguyễn Thái Học,Trường THPT Nguyễn Thái Học
5752,13319,truong trung hoc co so tran hung dao,Trường THPT Trần Hưng Đạo
5753,2861,trung tam gdnn gdtx huyen phu yen,TT GDNN-GDTX huyện Phù Yên
5754,1089,truong cao dang nghe co dien va xay dung bac ninh dtn,Cao Đẳng nghề Cơ điện và Xây Dựng Bắc Ninh
5755,9188,TTrường THPT Tran Hung Dao,Trường THPT Trần Hưng Đạo
5756,12829,Trường THPT le hog phog,Trường THPT Lê Hồng Phong
5757,14335,Cd thuong maj va du lich ha noj,Trường Cao Đẳng Thương mại và Du lịch Hà Nội
5758,7207,Trung cấp Kỹ thuật & Nghiệp vụ Nam Sài Gòn,Trung cấp Kỹ thuật - Nghiệp vụ Nam Sài Gòn
5759,12601,IEI - Đại Học Quốc Gia TP HCM,Đại Học Quốc Gia TP.HCM - Viện Đào Tạo Quốc Tế
5760,5241,cdn cong nghe va nl nam bo,CĐN Công nghệ và NL Nam Bộ
5761,1692,Trường THPT lam hong,Trường THPT Lam Hồng
5762,9525,Trung cap nong lam.,Trường trung cấp Nông Lâm Nghiệp Bình Dương
5763,132, National University of Civil Engineering ,Đại Học Xây dựng
5764,10515,truong my thuat thanh pho ho chi minh,Trường Đại học Mỹ thuật TP.HCM
5765,5851,btvh cap 2 3 nguyen thai hoc,"BTVH Cấp 2,3 Nguyễn Thái Học"
5766,1384,truong dai hoc tay do _tay do university,Đại Học Tây Đô
5767,86,ĐH Văn hóa HN,Đại Học Văn hóa Hà Nội
5768,2358,Trường THPT xuan giang,Trường THPT Xuân Giang
5769,9745,trung cap xd,Trường Trung cấp xây dựng Hà Nội
5770,4625,Trường THPT nguyen trai,Trường THPT Nguyễn Trãi
5771,2387,Trường THPT po tau,Trường THPT Pò Tấu
5772,4835,Trường THPT chuyen luong van chanh,Trường THPT Chuyên Lương Văn Chánh
5773,9791,PTTH NGHĨA HƯNG A,Trường THPT Nghĩa Hưng A
5774,170,HV Thanh thiếu niên VN,Học Viện Thanh thiếu niên Việt Nam
5775,6484,so giao duc va dao tao,Sở Giáo dục và Đào tạo
5776,4609,tt gdtx tinh,TT GDTX Tỉnh
5777,2867,truong Trường THPT mai son,Trường THPT Mai Sơn
5778,6518,truong Trường THCS va Trường THPT ta sin thang,Trường THCS-THPT Tả Sìn Thàng
5779,7807,DH Nong Lam TPHCM,Trường Đại học Nông Lâm TP.HCM
5780,10059,Trường trung học phổ thông amsterdam,Trường THPT chuyên Hà Nội - Amsterdam
5781,14134,hoc vien ky thuat quan su,Học viện Kỹ thuật Quân sự
5782,6096,Trường THPT nguyen viet dung,Trường THPT Nguyễn Việt Dũng
5783,11111,"University of Natural Sciences, HCMC, VN",Trường Đại học Khoa học Tự nhiên - Đại học Quốc Gia TP.HCM
5784,2637,tt gdtx tinh truoc 2018,TT GDTX tỉnh
5785,14472,Trường THPT Bạch Đằng - Thủy Nguyên - Hải Phòng,Trường THPT Bạch Đằng - Hải Phòng
5786,4841,trung tam ktth hn tinh,TT KTTH-HN tỉnh
5787,4527,Trường THPT tay giang,Trường THPT Tây Giang
5788,702,Học Viện Cảnh Sát Nhân Dân,Học Viện Cảnh Sát Nhân Dân
5789,14197,Trường THPT thị xã Phước long -bình phươc,Trường THPT Thị Xã Phước Long
5790,428,OVSF,Sĩ Quan Đặc Công
5791,13640,Trường THPT dam doi - Cà Mau,Trường THPT Đầm Dơi
5792,13740,trường đại học sư phạm ki thuật tp hcm,Trường Đại học Sư phạm Kỹ thuật TP.HCM
5793,11734,Trường THPT VietNam-BaLan,Trường THPT Việt Nam Ba Lan
5794,2618,Trường THPT chi lang,Trường THPT Chi Lăng
5795,9780,Trường THPT Trần Can huyện Điện Biên Đông,Trường THPT Trần Can
5796,5754,tc nghe ktkt cong doan ag,TC Nghề KTKT Công Đoàn AG
5797,8339,cao dang kinh te ke haoch da nang,Trường Cao Đẳng Kinh tế - Kế hoạch Đà Nẵng
5798,8975,PTTH Nguyễn Đình Chiểu Bến Tre,Trường THPT Nguyễn Đình Chiểu
5799,10967,Trường Cấp 3 Gang Thép,Trường THPT Gang Thép
5800,4822,tt gdtx dak po,TT GDTX Đak Pơ
5801,8192,Trường THPT NGO QUYEN BAVI HANOI,Trường THPT Ngô Quyền
5802,5697,tt gdtx huyen cao lanh,TT GDTX huyện Cao Lãnh
5803,12346,truong dai hoc si quan phong hoa,Trường Sĩ quan phòng hoá
5804,2887,truong Trường THPT chieng son,Trường THPT Chiềng Sơn
5805,3243,tt gdnn gdtx h viet yen,TT GDNN-GDTX H.Việt Yên
5806,12513,Trường THPT Tiên Du 2,Trường THPT Tiên Du 1
5807,8366,trungn học phổ thông diễn châu 4,Trường THPT Diễn Châu 4
5808,10646,Trường THPT Phù ninh-Phú thọ,Trường THPT Phù Ninh
5809,14525,thtp cheghevara,Trường THPT Chêguevara
5810,759,Đại Học Y Dược Cần Thơ,Đại Học Y Dược Cần Thơ
5811,13000,Trường cấp 3 Bến Tre,Trường THPT Bến Tre
5812,6433,Trường THPT ca mau,Trường THPT Cà Mau
5813,6351,trung tam day nghe va gdtx huyen thanh tri,TT dạy nghề và GDTX huyện Thạnh Trị
5814,5316,cao dang nghe tay ninh,Cao Đẳng Nghề Tây Ninh
5815,6684,HCMUS,Trường Đại học Khoa học Tự nhiên - Đại học Quốc Gia TP.HCM
5816,9932,truong Trường THCS-THPT hau thanh dong,Trường THCS-THPT Hậu Thạnh Đông
5817,421,DST,Khoa Công Nghệ – Đại Học Đà Nẵng
5818,11013,Trường THPT Bắc Kiến Xương - Thái Bình,Trường THPT Bắc Kiến Xương
5819,2090,Trường THPT hung dao,Trường THPT Hưng Đạo
5820,11536,Trường Trung Cấp Kinh Tế - Kỹ Thuật ĐăkLăk,Trường Trung Cấp Đắk Lắk - Cơ sở 1
5821,2017,Trường THCS va Trường THPT pham ngu lao,Trường THCS-THPT Phạm Ngũ Lão
5822,7596,Jbart Academy,TT Dạy Nghề Thẩm Mỹ Jb Art Academy 
5823,5280,Trường THPT dan toc noi tru ninh thuan,Trường THPT Dân tộc nội trú Ninh Thuận
5824,1645,Trường THPT ngoc hoi,Trường THPT Ngọc Hồi
5825,10120,ischool kien giang,Trường Ischool Rạch Giá
5826,9329,Trường THPT Bưng Riềng,Trường THPT Bưng Riềng
5827,14462,cao dang hoa chat,Trường Cao Đẳng Công nghiệp Hóa chất
5828,6805,Thu Xa High School,Trường Trường THPT Thu Xà
5829,10816,Trung cap cong nghjep bjnh duong,Trường Trung Cấp Công Nghiệp Bình Dương
5830,13107,Đại học Nội vụ Hà Nội,Trường Đại Học Nội Vụ Hà Nội
5831,11817,tdttdn,Trường Đại hoc Thể dục Thể thao Đà Nẵng
5832,12912,Trường THPT Yen Mo B,Trường THPT Yên Mô B
5833,2504,trung cap y te lao cai,Trung cấp Y tế Lào Cai
5834,9733,Trường THPT A Hải Hậu,Trường THPT A Hải Hậu
5835,1609,Trường THPT tran quang khai,Trường THPT Trần Quang Khải
5836,15, University of Social Science & Humanities ,Đại Học Khoa học Xã hội và Nhân văn
5837,10111,Trường THPT Nguyễn Đình Chuiểu,Trường THPT Dân Lập Nguyễn Đình Chiểu
5838,7423,"Phan Boi Chau High School, Cam Ranh",Trường THPT Phan Bội Châu
5839,5560,tc viet nhat,TC Việt – Nhật
5840,1359,hdqt dai hoc hoa sen,Đại học Hoa Sen
5841,2757,truong tc nghe kt 3d,Trường TC nghề KT 3D
5842,6273,trung tam gdnn gdtx huyen cang long,TT GDNN-GDTX huyện Càng Long
5843,10054,Trường trung học phổ thông cây dương,Trường THPT Cây Dương
5844,7976,Trung Học Phổ Thông Phú Điền,Trường THPT Phú Điền
5845,3891,Trường THPT cam thuy 2,Trường THPT Cẩm Thuỷ 2
5846,3545,Trường THPT nguyen trai,Trường THPT Nguyễn Trãi
5847,9046,truong ptth sang son,Trường THPT Sáng Sơn
5848,7532,Trường THPT Trực Ninh,Trường THPT Trực Ninh A
5849,6464,Trường THPT phu hung,Trường THPT Phú Hưng
5850,12391,Truong Trung Hoc Pho Thong Thoi Lai,Trường THPT THỚI LAI
5851,12635,TTPT Đien Hai,Trường THPT Điền Hải
5852,2455,Trường THPT tan uyen,Trường THPT Tân Uyên
5853,5874,TT GDTX long dien dat do,TT GDTX Long Điền - Đất Đỏ
5854,7086,Trường THPT Tran Hung Dao Hai Phong,"Trường THPT Trần Hưng Đạo, Hải Phòng"
5855,183, University of Medicine & Pharmacy ,Đại Học Y Dược TP.HCM
5856,1420,economy hcm,Đại học Kinh tế TP.HCM
5857,14006,Trường THPT thanh ba,Trường THPT Thanh Ba
5858,10440,Cao Đẳng nghề Giao thông vận tải Đường thủy 1,Trường Cao Đẳng GTVT đường thủy I
5859,14591,Trường CĐ kinh tế -kỹ thuật Phú Lâm,Trường Cao Đẳng nghề công nghệ kinh tế và chế biến lâm sản
5860,13066,Đại Học Đà Nẵng,Trường Đại Học Ngoại ngữ - ĐH Đà Nẵng 
5861,12217,Trường THPH Vĩnh Linh,Trường THPT Vĩnh Linh
5862,2438,Trường THPT nam tam,Trường THPT Nậm Tăm
5863,3666,Trường THPT luong the vinh,Trường THPT Lương Thế Vinh
5864,2126,Trường THPT vinh loc,Trường THPT Vĩnh Lộc
5865,7467,thanh pho vinh long,Thành phố Vĩnh Long
5866,14556,Trường THCS-THPT Phú Tân,Trường THCS-THPT Phú Tân
5867,731,Đại Học Kỹ Thuật Công Nghiệp – Đại Học Thái Nguyên,Đại Học Kỹ Thuật Công Nghiệp – Đại Học Thái Nguyên
5868,7308,dai hoc nog lam,Đại học Nông Lâm TP.HCM
5869,4948,Trường THPT nguyen thai binh,Trường THPT Nguyễn Thái Bình
5870,4727,ptdtnt Trường THCS-THPT van canh,PTDTNT Trường THCS-THPT Vân Canh
5871,6785,từng học tai Trường Trường THPT yaly,Trường THPT Ya Ly
5872,1771,gdnn gdtx huyen chuong my,GDNN-GDTX huyện Chương Mỹ
5873,3652,tt gdtx h giao thuy,TT GDTX H.Giao Thuỷ
5874,11689,phổ thông Đức Linh,Trường THPT Đức Linh
5875,10615,"Trường THPT  Chuyên Vị Thanh, Vị Thanh, Hậu Giang",Trường THPT Chuyên Vị Thanh
5876,928,cao dang yte ha  tinh,Cao Đẳng Y Tế Hà Tĩnh
5877,10276,Trường THPT Tô Hiệu Sơn La,Trường THPT Tô Hiệu
5878,6692,truong dai hoc nha trang,Trường Đại học Nha Trang
5879,12085,Đình Nhật,Điện Lạnh Đình Nhật
5880,4913,truong tcsp mam non dak lak,Trường TCSP Mầm non Đắk Lắk
5881,10825,Trường THPT Lý Thường Kiệt Hóc Môn,Trường THPT Lý Thường Kiệt
5882,10133,CDN Cơ điện và Thủy Lợi,Trường Cao Đẳng Cơ điện và Thủy lợi
5883,11042,TT GDTX tinh binh phuoc,TT GDTX Tỉnh Bình Phước
5884,1247,sp vat ly,Đại học Sư phạm Hà Nội
5885,7757,Quyh luu 2,Trường THPT Quỳnh Lưu 2
5886,11724,dai hoc cong ngiep thuc pham tp.hcm,Trường Đại học Công nghiệp Thực phẩm TP.HCM
5887,9301,Trường THPT Kim Binh,Trường THPT Kim Bình
5888,5784,Trường THPT nguyen chi thanh,Trường THPT Nguyễn Chí Thanh
5889,11944,Trường THPT Phan Bội Châu - Tam Kỳ,Trường THPT Phan Bội Châu
5890,12497,pho thong luc ngan so 1,Trường THPT Lục Ngạn số 1
5891,10198,Trường THPT Văn Hiến Long Khánh,Trường THPT Văn Hiến
5892,3951,ttgdnn gdtx hau loc,TT GDNN-GDTX Hậu Lộc
5893,6977,CĐ y tế Kiên Giang,Cao Đẳng Y tế Kiên Giang
5894,10522,binh doan 15 - BQP,"Binh đoàn 15, Bộ Quốc phòng"
5895,7769,TC Y te Ben Tre,Khoa Y Dược Cơ Sở IV Trường Cao Đẳng Bến Tre
5896,10408,Trường DH Mỹ Thuật Công Nghiệp Hà Nội,Trường Đại học Mỹ thuật Công nghiệp
5897,10729,truong trung hoc pho thong thanh ha hai dupng,Trường THPT Thanh Hà
5898,8282,Trường THPT Huyện Văn Lãng,Trường THPT Văn Lãng
5899,10601,Hoang Dieu School,Trường THPT Hoàng Diệu
5900,704,Trường Sĩ Quan Đặc Công,Sĩ Quan Đặc Công
5901,4698,Trường THPT so 1 phu my,Trường THPT Số 1 Phù Mỹ
5902,4447,Trường THPT tran quy cap,Trường THPT Trần Quý Cáp
5903,874,dai hoc nha trang,Đại học Nha Trang
5904,246,BMTU,Đại học Buôn Ma Thuột
5905,13962,Cao Dang Nghe Tphcm,Cao Đẳng Nghề TP.HCM
5906,1432,truong quan su quan khu 7,Quân Sự Quân Khu 7
5907,14334,Trường THPT lê hồng phong bỉm sơn thanh hoá,Trường THPT Lê Hồng Phong
5908,565,Đại Học Kinh Tế Công Nghiệp Long An,Đại Học Kinh Tế Công Nghiệp Long An
5909,6158,Trường THPT ngo van can,Trường THPT Ngô Văn Cấn
5910,8820,TTrường THPT Trần An Chiêm,Trường THPT Trần Ân Chiêm
5911,4418,Trường THPT vinh loc,Trường THPT Vinh Lộc
5912,8692,Trường THPT C Hai Hau,Trường THPT Hải Hậu C
5913,13727,Havart univesity,Đại học Harvard 
5914,2654,tt gdtx h na ri tinh bac kan,"TT GDTX H. Na Rì, tỉnh Bắc Kạn"
5915,10894,Trường THPTquang ha,Trường THPT Quang Hà
5916,805,national university of laos,Quốc gia Lào
5917,10710,Truong Trường THPT Phan Chu Trinh - Quan Hai An,Trường THPT Phan Chu Trinh
5918,13306,TC Cảnh Sát Nhân Dân I,Trường Cao Đẳng Cảnh Sát Nhân Dân 1
5919,13739,Trường THPT nguyen truong thuy,Trường THPT Nguyễn Trường Thúy
5920,5058,trung tam giao duc thuong xuyen lam dong,TT GDTX Lâm Đồng
5921,11089,Trường THPT b phuly,Trường THPT Phủ Lý B
5922,9401,Trường THPT cao ba quap,Trường THPT Cao Bá Quát
5923,8583,"Trường THPT Nguyễn Dục, Phú Ninh, Quảng Nam",Trường THPT Nguyễn Dục
5924,1290,cao dang suu pham long an,Cao Đẳng Sư phạm Long An
5925,10858,Viện Đại Học Mở Hà Nội tại Đà Nẵng,TT Đại Học Mở Hà Nội Đà Nẵng
5926,9313,Trường THPT Nguyễn Thái Học,Trường THPT Nguyễn Thái Học
5927,7415,PTDTNT Bac Lieu,Trường THPTDT Nội trú tỉnh Bạc Liêu
5928,6354,trung tam gdnn gdtx huyen thanh tri,TT GDNN-GDTX huyện Thạnh Trị
5929,1794,gdnn gdtx huyen thanh oai,GDNN-GDTX huyện Thanh Oai
5930,4068,Trường THPT do luong 2,Trường THPT Đô Lương 2
5931,9817,Đại học Nội vụ_Hà Nội,Trường Đại Học Nội Vụ Hà Nội
5932,7010,Trường Đại học công nghiệp Tp.HCM,Đại học Công nghiệp TP.HCM
5933,4157,trung tam gdnn gdtx can loc,TT GDNN-GDTX Can Lộc
5934,7537,Trường THPT Phú Tâm Châu Thành Sóc Trăng,Trường THPT Phú Tâm
5935,9343,cao đẵng nghề đà nẵng,Trường Cao Đẳng Nghề Đà Nẵng
5936,3933,ttgdnn gdtx ha trung,TT GDNN-GDTX Hà Trung
5937,6175,Trường THPT phan thanh gian,Trường THPT Phan Thanh Giản
5938,11671,Trường Trường THPT Hà Văn Mao. Bá Thước - Thanh Hóa,Trường THPT hà Văn Mao
5939,2873,truong ptdtnt Trường THCS-THPT huyen mai son,Trường THPTDTNT Trường THCS-THPT Huyện Mai Sơn
5940,884,truong dai hoc tdtt da nang,Đại hoc Thể dục Thể thao Đà Nẵng
5941,9606,cap 3 b kim son ninh binh,Trường THPT Kim Sơn B
5942,13923,Truong Trường THPT Cach Linh,Trường THPT Cách Linh
5943,13850,ĐH Kinh Tế Công Nghiệp Long An,Trường Đại học Kinh tế Công nghiệp Long An
5944,2627,tt gdtx dinh lap,TT GDTX Đình Lập
5945,13380,Trường Trung Học Phổ Thông Huyện Ngọc Hiển,Trường THPT Ngọc Hiển
5946,4436,cd kinh te ky thuat quang nam,CĐ Kinh tế - Kỹ thuật Quảng Nam
5947,6329,Trường THPT ke sach,Trường THPT Kế Sách
5948,4664,quoc hoc quy nhon,Quốc Học Quy Nhơn
5949,254,BLU,Đại Học Bạc Liêu
5950,5265,Trường THPT le loi,Trường THPT Lê Lợi
5951,9933,"UNITAS Japanese Language School, Japan",Trường Nhật ngữ Unitas Tokyo
5952,6726,Đại học Mỹ Tho,Trường Đại học Tiền Giang
5953,4790,truong Trường THPT ton duc thang,Trường THPT Tôn Đức Thắng
5954,4848,Trường THCS va Trường THPT chu van an,Trường THCS-THPT Chu Văn An
5955,9919,Trung Học Phổ Thông tai thi xa long khanh,Trường THPT Long Khánh
5956,4266,Trường THPT le thuy,Trường THPT Lệ Thuỷ
5957,8346,National Economics University (Vietnam),Trường Đại Học Kinh Tế Quốc Dân
5958,2556,Trường THPT chiem hoa,Trường THPT Chiêm Hóa
5959,10033,Trường TTPT Hương Thủy,Trường THPT Hương Thủy
5960,3858,Trường THCS-THPT quan son,Trường THCS-THPT Quan Sơn
5961,9019,Saigon University of Law,Trường Đại học Luật TP.HCM 
5962,14569,San khau va Dien Anh Ha noi,Trường Đại học Sân khấu Điện ảnh Hà Nội
5963,2935,truong Trường THPT thi xa phu tho,Trường THPT Thị xã Phú Thọ
5964,1688,Trường THPT soc son,Trường THPT Sóc Sơn
5965,4615,Trường THPT truong chinh,Trường THPT Trường Chinh
5966,5250,tt gdnn gdtx h phu giao,TT GDNN-GDTX H.Phú Giáo
5967,2352,Trường THPT kim ngoc,Trường THPT Kim Ngọc
5968,10650,Trường Biên Phòng 2 Vũng Tàu,Trường Trung cấp Biên phòng 2
5969,12357,nguyen hue hischool,Trường THPT Chuyên Nguyễn Huệ
5970,8802,Truong trung hoc phong thong nguyen thuong huyen,Trường THPT Nguyễn Thượng Hiền.
5971,14416,University of Languages & International Studies,"Trường Đại học Ngoại ngữ, Đại học Quốc gia Hà Nội"
5972,13569,truong Trường THPT Nam Dong Quan,Trường THPT Nam Đông Quan
5973,9114,cao dang duoc ninh binh,Trường Cao Đẳng Y tế Ninh Bình
5974,7938,PTTH Thanh Chuong I,Trường THPT Thanh Chương I
5975,3267,Trường THPT bac ninh,Trường THPT Bắc Ninh
5976,5618,Trường THPT chu van an,Trường THPT Chu Văn An
5977,6747,TCPH Báo Quốc,Trường TCPH Báo Quốc - Huế
5978,12954,Trường THPTsố 1 simacai,Trường THPT Số 1 Huyện Si Ma Cai
5979,11493,cao dang nhac hoa trung uong,Trường Đại Học Sư Phạm Nghệ Thuật Trung Ương
5980,4139,Trường THPT huong son,Trường THPT Hương Sơn
5981,699,Học Viện An Ninh Nhân Dân,Học Viện An Ninh Nhân Dân
5982,4376,Trường THPT phong dien,Trường THPT Phong Điền
5983,6617,cd nghe tran dai nghia,CĐ Nghề Trần Đại Nghĩa
5984,11381,truong pho thong vo thi sau,Trường THPT Võ Thị Sáu
5985,9356,Trương đai hoc hông dum,Trường Đại Học Hồng Đức
5986,13767,TT giao duc thương xuyên huyên Mo Cay Nam,TT GDTX Huyện Mỏ Cày Nam
5987,7768,phong chay chua chay,Phòng cháy chữa cháy
5988,12121,Lê Lợi - Trường THPT Lê Lợi,Trường THPT Lê Lợi
5989,4706,Trường THPT my tho tu 2020,Trường THPT Mỹ Thọ
5990,460,BDU,Đại Học Bình Dương
5991,6292,trung tam gdnn gdtx huyen chau thanh,TT GDNN-GDTX huyện Châu Thành
5992,8187,Trường THPT Chuyen NTMK-Soc Trang,Trường THPT chuyên Nguyễn Thị Minh Khai
5993,2273,tt gdtx thanh pho,TT GDTX Thành Phố
5994,14212,Trường quân sự tỉnh sơn la,Trường quân sự tỉnh Sơn La
5995,4231,Trường THCS va Trường THPT hoa tien,Trường THCS-THPT Hoá Tiến
5996,7704,Trường THPT Cai Nuoc,Trường THPT Cái Nước
5997,10718,truong dai học công nghệ thực phẩm hồ chí minh,Trường Đại học Công nghiệp Thực phẩm TP.HCM
5998,9258,Dan lap Tay Do,Trường THPT Dân Lập Tây Đô
5999,7363,Mỹ Đức A,Trường THPT Mỹ Đức A
6000,70, VNUF,Đại Học Lâm nghiệp
6001,6719,Trường THPT Van Chan _ Yen Baj,Trường THPT Văn Chấn - Yên Bái
6002,5140,trung tam giao duc nghe nghiep huyen bao lam,TT Giáo dục nghề nghiệp huyện Bảo Lâm
6003,1425,cao dang su pham ba ria vung tau c52,Cao Đẳng Sư phạm Bà Rịa-Vũng Tàu
6004,576,Đại Học Phạm Văn Đồng,Đại Học Phạm Văn Đồng
6005,3743,Trường THPT hung vuong,Trường THPT Hùng Vương
6006,9112,Dai hoc Duy Tan,Trường Đại Học Duy Tân
6007,13162,truong trung hoc pho thong hiep hoa so 3,Trường THPT Hiệp Hòa số 3
6008,1971,cd kt kt cong nghiep 2,CĐ KT KT Công Nghiệp 2
6009,9028,Ueb- Đh Qg Hn,Trường Đại học Kinh tế - ĐHQGHN
6010,10453,Trường THPT Số 1 Bắc Hà,Trường THPT số I Bắc Hà
6011,545,Khoa Y Dược – Đại Học Đà Nẵng,Khoa Y Dược – Đại Học Đà Nẵng
6012,14526,Trường trung học phổ thông cây dương,Trường THPT Cây Dương
6013,9386,trung cap safi,Trường Trung cấp Tổng hợp Sài Gòn - Cơ Sở Bình Tân
6014,1439,truong dhktkt binh duong,Đại học Kinh tế - Kỹ Thuật Bình Dương
6015,13926,Truong trung cap y duoc ha nam,Trường Cao Đẳng Y tế Hà Nam
6016,7370,Trường THPTth cấp 3 hoa lư b,Trường THPT Hoa Lư A
6017,1178,dh gtvt cs 2,Đại học Giao thông Vận tải cơ sở 2
6018,4007,Trường THPT quy hop,Trường THPT Quỳ Hợp
6019,13619,cao dang may lanh,Trường Cao Đẳng Điện Tử - Điện Lạnh Hà Nội
6020,5573,Trường THCS-THPT hau thanh dong,Trường THCS-THPT Hậu Thạnh Đông
6021,9882,truong Trường THPT Doan Ket,Trường THPT Đoàn Kết - Hai Bà Trưng
6022,13341,Phổ thông Cửa Tùng,Trường THPT Cửa Tùng
6023,11636,Đại Học Hàng Hải,Trường Đại học Hàng hải Việt Nam
6024,9302,ptth an nhon tay,Trường THPT An Nhơn Tây
6025,5366,Trường THPT nguyen trung truc tu 01 02 2020,Trường THPT Nguyễn Trung Trực
6026,13004,Trường THPT Nam Đàn 2,Trường THPT Nam Đàn 2
6027,12283,TTrường THPT Duong Minh Chau,Trường THPT Dương Minh Châu
6028,8129,Trung hoc Ben Tre,Trường THPT Bến Tre
6029,3352,Trường THPT kinh mon ii truoc 28 4 2017,Trường THPT Kinh Môn II
6030,2383,Trường THPT tra linh truoc 01 3 2020,Trường THPT Trà Lĩnh
6031,13059,Trương Trường THPT Hoang Hoa Tham Le Thuy,Trường THPT Hoàng Hoa Thám
6032,7054,National Education Univercity,"Đại học Giáo dục, Đại học Quốc gia Hà Nội"
6033,5149,trung tam gdnn gdtx huyen dam rong,TT GDNN-GDTX huyện Đam Rông 
6034,405,HANU,Đại Học Hà Nội
6035,6803,truong Trường THPT nguyen khuyen Bh,Trường THPT Nguyễn Khuyến
6036,5836,Trường THPT vinh trach,Trường THPT Vĩnh Trạch
6037,6748,truong Trường THPT thanh pho cao lanh,Trường THPT Thành Phố Cao Lãnh
6038,13215,Trường THPT chuyen Le Hong Phong-ND,Trường THPT chuyên Lê Hồng Phong
6039,10434,Dong Nai University of Technology Biên Hòa,Trường Đại Học Công Nghệ Đồng Nai
6040,3423,Trường THPT duc hop,Trường THPT Đức Hợp
6041,11028,Trường THPT Chu Văn An,Trường THPT Chu Văn An 
6042,11868,Trường THPT Nguyên cảnh chân,Trường THPTth Nguyễn Cảnh Chân
6043,3281,Trường THPT pho moi,Trường THPT Phố Mới
6044,6376,Trường THPT my quoi,Trường THPT Mỹ Quới
6045,14503,Đại học Thái Bình Dương,Trường Đại học Thái Bình Dương
6046,11828,CYK - Trường Cao Đẳng Y Tế Khánh Hòa,Trường Cao Đẳng Y tế Khánh Hòa
6047,14588,TC Nghiep Vu Khach San HN,Trường Trung Cấp Nghề Nấu Ăn - Nghiệp Vụ Du Lịch Và Thời Trang Hà Nội
6048,12229,PT PHƯỚC BỬU,Trường THPT Phước Bửu
6049,11875,Đại Học Tân Trào,Đại học Tân Trào Tuyên Quang
6050,4504,Trường THPT nguyen hue,Trường THPT Nguyễn Huệ
6051,5230,cdn viet nam singapore,CĐN Việt Nam - Singapore
6052,3412,Trường THPT chuyen hung yen,Trường THPT Chuyên Hưng Yên
6053,1448,dh n0ng nghiep ha n0i,Đại học Nông nghiệp Hà Nội
6054,11831,ĐHSP Hà Nội 2,Trường Đại học Sư phạm Hà Nội 2
6055,6470,ttgdnn dam doi,TTGDNN Đầm Dơi
6056,9962,Trường Đại học Công đoàn,Trường Đại Học Công Đoàn
6057,3725,Trường THPT nguyen hue,Trường THPT Nguyễn Huệ
6058,12914,Trường Đại Học sư phạm kĩ thuật Vĩnh Long,Trường ĐH Sư phạm Kỹ thuật Vĩnh Long
6059,4632,Trường THPT nguyen van cu,Trường THPT Nguyễn Văn Cừ
6060,512,VTT,Đại Học Võ Trường Toản
6061,4499,Trường THPT thai phien,Trường THPT Thái Phiên
6062,5367,tt gdnn gdtx hoa thanh tu 01 02 2020,TT GDNN-GDTX Hòa Thành
6063,10420,Trường THPT Nguyễn Đình Chiểu - thua thjen hue,Trường THPT Nguyễn Đình Chiểu
6064,9864,Truong Đại hoc công nghệ  kỹ thuật Hà nội,Trường Đại học Kinh tế Kỹ thuật Công nghiệp 
6065,1025,dai hoc khoa hoc tu nhien tp ho chi minh- dhqg tphcm,Đại học Khoa học Tự nhiên - Đại học Quốc Gia TP.HCM
6066,6587,truong trung cap ky thuat cong nghe tinh hau giang,Trường Trung cấp Kỹ thuật-Công nghệ tỉnh Hậu Giang
