,index,text,normed_text
2703,11137,Trường mầm non Mỹ Thái,Trường Mầm Non Mỹ Thái
2704,6390,Trường THPT hiep thanh,Trường THPT Hiệp Thành
2705,276,Đại Học Nông Lâm – Đại Học Huế,Đại Học Nông Lâm – Đại Học Huế
2706,11465,TTPT Phả Lại,Trường THPT Phả Lại
2707,9718,Trường THPT Cù Chính Lan,Trường THPT Cù Chính Lan
2708,6558,tt gdnn gdtx cu jut,TT GDNN-GDTX Cư Jút
2709,5970,cao dang nghe tinh kien giang,Cao Đẳng Nghề tỉnh Kiên Giang
2710,9986,Trường THPT Phan Châu Trinh Đà Nẵng,Trường THPT Phan Châu Trinh
2711,3178,cd nghe cong nghe viet han bac giang,CĐ nghề Công nghệ Việt - Hàn Bắc Giang
2712,10934,PTTH Phu My II,Trường THPT số 2 Phù Mỹ
2713,14170,Cao Đẳng ngô gia tự,Trường CĐ sư phạm Ngô Gia Tự
2714,6880,Truong PTDT Noi Tru Pac Nam,Trường THPTDT Nội trú Pác Nặm
2715,9430,Trường THPT Nguyễn An Ninh Q10,Trường THPT Nguyễn An Ninh
2716,13309,Trường THPT Đa Phúc,Trường THPT Đa Phúc
2717,2998,truong Trường THPT thach kiet,Trường THPT Thạch Kiệt
2718,14407,"UNITAS Japanese Language School, Japan",Trường Nhật ngữ Unitas Tokyo
2719,11011,Trường THPT Lý Thường Kiệt 2,Trường THPT Lý Thường Kiệt
2720,11239,dh sư phạm kĩ thuật hưng yên,Trường Đại học Sư Phạm Kỹ Thuật Hưng Yên
2721,4838,Trường THPT nguyen truong to,Trường THPT Nguyễn Trường Tộ
2722,11070,EIU Đại Học Quốc Tế Miền Đông,Đại học Quốc tế Miền Đông
2723,7837,Cao Đẳng Sư Phạm Lạng Sơn,Cao Đẳng Sư phạm Lạng Sơn
2724,3493,Trường THPT duong quang ham,Trường THPT Dương Quảng Hàm
2725,5285,tt gdtx hn ninh thuan,TT GDTX-HN Ninh Thuận
2726,12168,Trường Mỹ Thuật Công Nghiệp HN,Trường Đại học Mỹ thuật Công nghiệp
2727,8853,Cao Đẳng  kĩ thuật bắc ninh,Trường Cao Đẳng Công nghiệp Bắc Ninh
2728,10875,Daj hoc y khoa vjnh,Trường Đại học Y khoa Vinh
2729,3667,Trường THPT nguyen binh,Trường THPT Nguyễn Bính
2730,12039,Trường THPT Lương Văn Can,Trường THPT Lương Văn Can Hà Nội
2731,3887,Trường THPT thach thanh 3,Trường THPT Thạch Thành 3
2732,7253,cap 3 Kien An Hai Phong Viet Nam,Trường THPT Kiến An
2733,7240,Trường THPT Tôn Đức Thắng krông Năng Đắklắk,Trường THPT Tôn Đức Thắng
2734,12972,Trường CĐN HD,Trường Cao Đẳng Nghề Hải Dương
2735,13268,cdcd hau giang,Trường Cao Đẳng Cộng Đồng Hậu Giang
2736,14056,Trung cấp Văn hóa Nghệ thuật tỉnh Vĩnh phúc,Trường Trung Học Văn Hóa Nghệ Thuật Vĩnh Phúc
2737,5236,tt gdnn gdtx tx di an,TT GDNN-GDTX TX.Dĩ An
2738,6,ĐH Ngoại thương,Đại Học Ngoại thương
2739,10690,Trường Cao Đẳng Công Nghệ và Quản Trị Sonadezi,Trường Cao Đẳng Công nghệ và Quản trị Sonadezi
2740,7577,Trường Trung học phổ thông Sơn Nam,Trường THPT Sơn Nam
2741,9996,Trường THPT Lý Tự Trọng- Nam Trực- Nam Định,Trường THPT Lý Tự Trọng
2742,1243,truong dai hoc kinh bac bac ninh ukb,Đại học Kinh Bắc
2743,11872,Trung hoc pho thong thaj hoa,Trường THPT Thái Hòa
2744,10290,Trường THPT Chuyen BL,Trường THPT Chuyên Bạc Liêu
2745,13288,Truong trung hoc ky thuat Vinh Long,Trường ĐH Sư phạm Kỹ thuật Vĩnh Long
2746,8422,dtnt no trang long,Trường THPT Dân tộc Nội trú Nơ Trang Lơng
2747,9357,Cđ luong thuc thuc pham,Trường Cao Đẳng Lương thực - Thực phẩm
2748,13909,Tung hk Trường THPT leloi,Trường THPT Lê Lợi
2749,4638,Trường THPT quang trung,Trường THPT Quang Trung
2750,7505,Truong pho thong noi tru Nghệ an,Trường THPT Dân tộc Nội trú Nghệ An
2751,4883,Trường THPT pham van dong,Trường THPT Phạm Văn Đồng
2752,11845,Trường THCS-THPT Hiển Nhân,Trường THCS-THPT Hiển Nhân
2753,4954,Trường THPT pham van dong,Trường THPT Phạm Văn Đồng
2754,11032,Trường THPT Đinh Tiên Hoàng Thành Phố Vũng Tàu,Trường THPT Đinh Tiên Hoàng
2755,9300,Trường THPT Nà Phặc,Trường THCS-THPT Nà Phặc
2756,6780,Dhspthaingtuyen,Đại học Sư phạm Thái Nguyên
2757,4661,phong gd dt huyen tu mo rong,Phòng GD-ĐT huyện Tu Mơ Rông
2758,7282,"Kim Lien High Shool, Hanoi",Trường THPT Kim Liên
2759,11236,The Han0i pedag0gical university N02,Trường Đại học Sư phạm Hà Nội
2760,5445,th Trường THCS-THPT tan hoa,Trường THCS-THPT Tân Hòa
2761,12704,Trường THPT ngô gia tự - lập thạch - vĩnh phúc,Trường THPT Ngô Gia Tự
2762,13315,Trường THPT gia vien b ninh binh,Trường THPT Gia Viễn B
2763,2586,Trường THPT hoang van thu,Trường THPT Hoàng Văn Thụ
2764,12684,CD Su Pham Nha Trang,Trường Cao Đẳng Sư Phạm Trung Ương Nha Trang
2765,6287,Trường THPT vu dinh lieu,Trường THPT Vũ Đình Liệu
2766,14350,Trường ĐH kĩ thuật y tế Hải Dương,Đại học Kỹ thuật Y tế Hải Dương
2767,5213,dai hoc binh duong,Đại học Bình Dương
2768,8387,truong quan su qk4,Trường Quân sự Quân khu 4
2769,5657,Trường THPT ban cong lai vung,Trường THPT bán công Lai Vung
2770,11399,"Trường THPT Phan chu trinh,eahleo,daklak",Trường THPT Phan Chu Trinh Daklak
2771,11905,"University of Economic Ho Chi Minh City, 2010",Trường Đại học Kinh tế TP.HCM
2772,11128,Nguyễn Huệ .Yên Bái,Trường THPT Nguyễn Huệ
2773,12332,truong trung hoc pho thong van ngoc chin,Trường THPT Văn Ngọc Chính
2774,3427,Trường THPT nguyen trai,Trường THPT Nguyễn Trãi
2775,12473,Trường THCS Lương Thế Vinh Q1,Trường THPT Lương Thế Vinh
2776,652,Đại Học Sư Phạm Nghệ Thuật Trung Ương,Đại Học Sư Phạm Nghệ Thuật Trung Ương
2777,3918,truong cd nl t hoa,Trường CĐ NL T.Hóa
2778,4125,trung tam dn hn va gdtx tp hatinh,TT DN-HN và GDTX TP HàTĩnh
2779,4052,Trường THPT dien chau 4,Trường THPT Diễn Châu 4
2780,829,dai hoc mo thanh pho ho chi minh,Đại Học Mở TP.HCM
2781,3278,Trường THPT que vo so 1,Trường THPT Quế Võ số 1
2782,3031,Trường THPT nguyen thi giang,Trường THPT Nguyễn Thị Giang
2783,9369,Trường Đại Học An ninh Hà Nội,Học Viện An ninh Nhân Dân
2784,12451,PTTH Tân Phú - Định Quán - Đồng Nai,Trường THPT Tân Phú
2785,11154,Trường trung cấp nghề DTNT An Giang,Trường Trung cấp nghề Dân tộc nội trú An Giang
2786,2362,quan nhan cong an tai ngu_06,"Quân nhân, Công an tại ngũ_06"
2787,501,Đại học Nguyễn Huệ,Đại học Nguyễn Huệ
2788,7211,Trường THPT hoàng hoa tham thụy lôi hưng yên,Trường THPT Hoàng Hoa Thám
2789,2636,Trường THPT chuyen,Trường THPT Chuyên
2790,810,nhac vien thanh pho ho chi minh,Nhạc Viện TP.HCM
2791,10525,DVTC,Trường Cao Đẳng Du Lịch Đà Nẵng
2792,12495,Cao Đẳng hóa chất,Trường Cao Đẳng Công nghiệp Hóa chất
2793,10300,Trường Trần Văn Quan,Trường THPT Trần Văn Quan
2794,6210,tt gdnn gdtx tp vinh long,TT GDNN-GDTX TP Vĩnh Long
2795,4119,Trường THPT hoang mai truoc nam 2013,Trường THPT Hoàng Mai
2796,3472,Trường THPT nguyen du,Trường THPT Nguyễn Du
2797,3220,Trường THPT hiep hoa so 2,Trường THPT Hiệp Hòa số 2
2798,4517,Trường THPT nam giang,Trường THPT Nam Giang
2799,5227,Trường THPT trinh hoai duc,Trường THPT Trịnh Hoài Đức
2800,12757,truong tien du1,Trường THPT Tiên Du 1
2801,417,SMP-VNUH,Khoa Y Dược - Đại học Quốc Gia Hà Nội
2802,14057,Trường ĐHKT Thái Nguyên,Trường Đại học Kinh tế và Quản trị kinh doanh - Đại học Thái Nguyên
2803,5289,Trường THPT le duan,Trường THPT Lê Duẩn
2804,2351,pt dtnt cap 2 3 bac quang,PT DTNT cấp 2-3 Bắc Quang
2805,3259,Trường THPT ly nhan tong,Trường THPT Lý Nhân Tông
2806,13513,Nghĩa Hưng C,Trường THPT C Nghĩa Hưng
2807,11442,DHTDTT Bắc Ninh,Trường Đại học Thể dục Thể thao Bắc Ninh
2808,3184,Trường THPT mo trang,Trường THPT Mỏ Trạng
2809,6136,Trường THPT chuyen ben tre,Trường THPT Chuyên Bến Tre
2810,1726,Trường THPT bat bat,Trường THPT Bất Bạt
2811,4460,Trường THPT ho nghinh,Trường THPT Hồ Nghinh
2812,14040,CĐSP NT,Trường Cao Đẳng Sư phạm Trung ương
2813,3409,tt gdnn gdtx binh giang,TT GDNN-GDTX Bình Giang
2814,9298,Trường THPT nguyen thi minh khai duc tho,Trường THPT Nguyễn Thị Minh Khai
2815,8925,Trường THPT Nguyễn Huệ - Tam Điệp - Ninh Bình,"Trường THPT Nguyễn Huệ, Ninh Bình"
2816,6973,PTTH LÊ VIẾT THUẬT TP VINH,Trường THPT Lê Viết Thuật
2817,14209,Truong DHSP Ha Noi 2,Trường Đại học Sư phạm Hà Nội 2
2818,9377,Trường Cao Đẳng Nghề Thanh Niên Dân Tộc Tây Nguyên,Trường Cao Đẳng Công nghệ Tây Nguyên
2819,4745,tt gdnn gdtx tuy phuoc,TT GDNN-GDTX Tuy Phước
2820,10426,Trường THPT Bac Dong Quan,Trường THPT Bắc Đông Quan
2821,6110,Trường THPT giai xuan,Trường THPT Giai Xuân
2822,4438,truong tc vhnt dl q nam truoc 01 01 2019,Trường TC VHNT-DL Q. Nam
2823,14488,Truong Trường THPT Quynh Coi,Trường THPT Quỳnh Côi
2824,14277,THPH huynh ngoc hue,Trường THPT Huỳnh Ngọc Huệ
2825,2235,Trường THPT tan an,Trường THPT Tân An
2826,10871,Trường Trung Học Chuyên Ban ĐÀo Duy Từ _Đồng Hới_Quảng Bình,Trường THPT Đào Duy Từ
2827,4688,Trường THPT nguyen tran,Trường THPT Nguyễn Trân
2828,12333,"Đông Dô, Mỏ Địa Chất hà nội",Trường Đại học Mỏ - Địa chất.
2829,13282,Trường THPT Nguyễn Thiện Thuật,Trường THPT Nguyễn Thiện Thuật
2830,9776,"Trường THPT Đoàn kết, Hà nội",Trường THPT Đoàn Kết - Hai Bà Trưng
2831,9402,Truog Trường THPT thah chuog 1,Trường THPT Thanh Chương I
2832,1636,Trường THCS-THPT ha thanh,Trường THCS-THPT Hà Thành
2833,107,HV Tòa Án,Học Viện Tòa Án
2834,5337,Trường THPT chau thanh,Trường THPT Châu Thành
2835,8000,Trường THPT HUYNH THUC KHAN,Trường THPT Huỳnh Thúc Kháng
2836,13625,ĐH Giao thông sắt bộ,Trường Đại học Giao thông Vận tải
2837,13302,Đại họx ngoại ngữ,"Trường Đại học Ngoại ngữ, Đại học Quốc gia Hà Nội"
2838,204, HCM National Academy of Politics ,Học Viện chính trị quốc gia
2839,11925,Trường THPT Định An,Trường THPT Định An
2840,5217,Trường THPT ben cat,Trường THPT Bến Cát
2841,14450,Trường Trung Học Phổ Thông Đô Lương 4,Trường THPT Đô Lương 4
2842,9788,CĐ Sư Phạm Ninh Thuận,Trường CĐ Sư phạm Ninh Thuận
2843,6457,Trường THPT song doc,Trường THPT Sông Đốc
2844,2059,Trường THCS-THPT dong du,Trường THCS-THPT Đông Du
2845,12052,truong chuyên biệt tương lai,Trường Chuyên biệt Tương Lai
2846,13086,Trường THPT Trùng Khánh Cao Bằng,Trường THPT Trùng Khánh
2847,7957,Truong CĐN Cơ Giới Ninh Bình,Trường Cao Đẳng Cơ Giới Ninh Bình
2848,5855,cd nghe du lich vung tau,CĐ nghề Du lịch Vũng Tàu
2849,4922,Trường THPT phan chu trinh,Trường THPT Phan Chu Trinh
2850,3771,Trường THPT ninh binh bac lieu,Trường THPT Ninh Bình - Bạc Liêu
2851,10969,Trường THPT Luong Ngoc Quyen - TN,Trường THPT Lương Ngọc Quyến
2852,4896,tt gdtx tinh,TT GDTX Tỉnh
2853,5312,pho thong dan toc noi tru tay ninh,Trường THPT dân tộc nội trú Tây Ninh
2854,13469,Thang long-Ha noi technical college,Trường Trung cấp Kinh tế Kỹ thuật Bắc Thăng Long
2855,9338,PTTH Hai Bà Trưng,Trường THPT Đoàn Kết - Hai Bà Trưng
2856,7754,"Truong Cao Dang Su Pham, Ba Ria",Cao Đẳng Sư phạm Bà Rịa-Vũng Tàu
2857,5375,Trường THPT phan chu trinh,Trường THPT Phan Chu Trinh
2858,13032,Danang Vocational Training College,Trường Cao Đẳng Nghề Đà Nẵng 
2859,3990,cd nghe ky thuat cong nghiep viet nam han quoc,CĐ Nghề Kỹ thuật - Công nghiệp Việt Nam - Hàn Quốc
2860,1499,ueh isb_master of business,Đại Học Kinh Tế TP.HCM
2861,2080,dh cong nghiep thuc pham tp hcm,ĐH Công Nghiệp Thực Phẩm TP.HCM
2862,5497,Trường THPT hong bang,Trường THPT Hồng Bàng
2863,5392,Trường THPT nguyen khuyen,Trường THPT Nguyễn Khuyến
2864,4982,Trường THPT le thanh ton,Trường THPT Lê Thánh Tôn
2865,11412,Trường THPT namcao,Trường THPT Nam Cao
2866,397,HVN,Học Viện Nông Nghiệp Việt Nam
2867,2629,Trường THPT van nham,Trường THPT Vân Nham
2868,8305,Trung cap Ki thuat va Nghiep vu Nam Sài Gòn,Trường Cao Đẳng Bách khoa Nam Sài Gòn
2869,120, Phuong Dong University ,Đại Học Phương Đông
2870,9470,Trường Đại Học Đông Á,Trường đại học Công nghệ Đông Á
2871,6513,trung tam gdtx huyen muong cha thi tran muong cha huyen muong cha,"TT GDTX huyện Mường Chà Thị trấn Mường Chà, huyện Mường Chà"
2872,3139,Trường THPT minh ha,Trường THPT Minh Hà
2873,6901,Cao Đẳng Kỹ Thuật Cao Thắng,Cao Đẳng Kỹ thuật Cao Thắng
2874,2946,truong Trường THPT ban cong doan hung thi tran doan hung huyen doan hung,"Trường THPT Bán Công Đoan Hùng Thị trấn Đoan Hùng, huyện Đoan Hùng"
2875,7115,Trường THCS Thong Nong,Trường THPTDTNT-THCS Thông Nông
2876,13684,PTTH kim lien nam dan nghe an,Trường THPT Kim Liên
2877,1589,Trường THPT ho tung mau,Trường THPT Hồ Tùng Mậu
2878,11212,Trường Đại Học Tiền Giang,Trường Đại học Tiền Giang
2879,3694,Trường THPT tran nhan tong,Trường THPT Trần Nhân Tông
2880,6357,Trường THCS-THPT tan thanh,Trường THCS-THPT Tân Thạnh
2881,372,EAUT,Đại học Công nghệ Đông Á
2882,464,Đại Học Kỹ Thuật - Hậu Cần Công An Nhân Dân ( Phía Nam ),Đại Học Kỹ Thuật - Hậu Cần Công An Nhân Dân 
2883,8618,PT Đông Thọ,Cụm Công nghiệp đông thọ
2884,1271,dai hoc kan tho,Đại học Cần Thơ
2885,13154,thph minh khai,Trường THPT Nguyễn Thị Minh Khai
2886,863,truong dai hoc tong hop ha noi,Đại học Tổng hợp Hà Nội
2887,14234,Trung Học Sa Đéc,Trường THPT Thành phố Sa Đéc
2888,7296,Yen khanh B khoa 2002,Trường THPT Yên Khánh B
2889,9935,kinh te ki thuat quang nam,Trường Cao Đẳng Quảng Nam
2890,7727,Trường trung cấp Lâm nghiệp Tây nguyên,Trường Trung Cấp Lâm Nghiệp Tây Nguyên
2891,6219,Trường THCS va Trường THPT my phuoc,Trường THCS-THPT Mỹ Phước
2892,989,da tung hoc dai hoc tong hop,Đại Học Tổng Hợp Hà Nội
2893,7453,Trường THPT Trương Định,Trường THPT Trương Định
2894,13634,Trường Kỹ thuật Công nghệ Hùng Vương,Trường trung cấp nghề Kỹ thuật Công nghệ Hùng Vương
2895,8897,Trường THPT Triệu Quang Phục,Trường THPT Triệu Quang Phục
2896,12103,Trường THPT Nguyên Công Hoan,Trường THPT Nguyễn Công Hoan
2897,9570,Cao Đẳng sư phạm TDTTTW1 Hà nội,Trường Cao Đẳng Sư phạm Trung ương
2898,1839,Trường THPT nguyen du me linh truoc 5 2019,Trường THPT Nguyễn Du-Mê Linh
2899,518,LTVU,Đại học Dân lập Lương Thế Vinh
2900,9029,Truong CB le Hong Phong tp Ha Noi,Trường Đào Tạo Cán Bộ Lê Hồng Phong
2901,11126,PN HIght School,Trường THPT Phan Huy Chú - Đống Đa
2902,11749,Trường trung học phổ thông Phan Văn Trị,Trường THPT Phan Văn Trị
2903,10844,TT GDTX Gia Viễn,TT GDTX Gia Viễn
2904,7418,Truong Trường THPT Nguyen Van Linh,Trường THPT Nguyễn Văn Linh
2905,6103,Trường THPT luong dinh cua,Trường THPT Lương Định Của
2906,7205,Trường trung học phổ thông Nghi Lộc 2,Trường THPT Nghi Lộc 2
2907,8444,Trường Đại học Mỹ thuật Hà Nội,Trường Đại học Mỹ thuật Việt Nam
2908,881,khoa quoc te - dai hoc quoc gia ha noi (is-vnu),Khoa Quốc Tế - Đại học Quốc gia Hà Nội
2909,1141,danang vocational tourism college dvtc,Cao Đẳng DU LỊCH ĐÀ NẴNG
2910,6926,Dai hoc cong nghjep tphcm co so thanh hoa,ĐH Công nghiệp TP.HCM Cơ sở Thanh Hoá
2911,14601,Trường THPT Trần Nguyên Hãn,Trường THPT Trần Nguyên Hãn
2912,11310,Bach Khoa University,Trường Đại học Bách khoa - Đại học Quốc gia TP.HCM
2913,9122,Trường THPT AN PHUOC,Trường THPT An Phước
2914,10772,Trường THPT HoaNinh,Trường THPT Hòa Ninh
2915,1113,cd dl mien trung,Cao Đẳng Điện Lực Miền Trung
2916,4043,Trường THPT le doan nha,Trường THPT Lê Doãn Nhã
2917,6342,trung tam gdnn gdtx huyen my tu,TT GDNN-GDTX huyện Mỹ Tú
2918,12786,trung cap tan thanh,Trường Trung cấp Kinh tế và Du Lịch Tân Thanh
2919,8716,Trường THPT Nguyen Văn Cư,Trường THPT Nguyễn Văn Cừ
2920,4152,Trường THPT nguyen cong tru,Trường THPT Nguyễn Công Trứ
2921,2494,Trường THPT so 2 tp lao cai,Trường THPT số 2 Tp Lào Cai
2922,13098,Y - Dược Hà Nội,Trường Cao Đẳng Y DƯỢC HÀ NỘI
2923,10623,Trường THPT long huu,Trường THPT Long Hữu
2924,14540,Dai hoc nông nghiep,Học viện Nông nghiệp Việt Nam
2925,757,Đại Học Y Hải Phòng,Đại Học Y Hải Phòng
2926,7870,Trường THPT VĂN HIẾN - Hà Nội,Trường THPT VĂN HIẾN
2927,10479,Trường Trường THPT Chuyên Lê Khiết,Trường THPT chuyên Lê Khiết
2928,10481,Trường THPT Chương Mỹ A,Trường THPT Chương Mỹ A
2929,2930,trung tam gdtx tinh phu tho,TT GDTX tỉnh Phú Thọ
2930,10153,Ho Chi Minh City Open University,Trường ĐH Mở TP.HCM
2931,871,cao dang van hoa nghe thuat va du lich nha trang,Cao Đẳng Văn Hóa Nghệ Thuật Du Lịch Nha Trang
2932,1894,cd nghe thanh pho ho chi minh,CĐ nghề TP.HCM
2933,1797,tc nghe tu thuc dien tu co khi va xay,TC nghề Tư thục Điện tử - Cơ khí và Xây
2934,12164,Trường THPT Ứng Hòa A,Trường THPT Ứng Hòa A
2935,8164,Truong Trường THPT dan lap tan yen,Trường THPT Hoàng Hoa Thám
2936,5543,Trường THPT long khanh,Trường THPT Long Khánh
2937,9365,Học viện Ngoại Giao Việt Nam,Học viện Ngoại giao
2938,4343,Trường THPT huong phung,Trường THPT Hướng Phùng
2939,9396,Trường Trường THPT Nguyễn Thái Bình,Trường THPT Nguyễn Thái Bình
2940,8760,Truong TH Hieu Thien,truong tieu hoc Hieu Thien
2941,6546,Trường THPT nguyen tat thanh,Trường THPT Nguyễn Tất Thành
2942,1871,Trường THPT huynh thuc khang truoc 12 2013,Trường THPT Huỳnh Thúc Kháng
2943,573,Đại học Nam Cần Thơ,Đại học Nam Cần Thơ
2944,2860,truong Trường THPT gia phu,Trường THPT Gia Phù
2945,13482,Trường THPT tuyên hoá,Trường THPT Tuyên Hóa - Quảng Bình
2946,14534,TTrường THPT my duc c,Trường THPT Mỹ Đức C
2947,1075,dai hoc su pham ha noi I,Đại học Sư phạm Hà Nội
2948,873,hoc vien quan y 103,Học viện Quân Y
2949,13646,phổ thông lấp vò 2,Trường THPT Lấp Vò 2
2950,392,HDU,Đại Học Hồng Đức
2951,7826,Cục kỹ thuật PK-KQ,"Cục Kỹ thuật, Quân chủng Phòng không-Không quân Việt Nam"
2952,6964,Đại Học Y Học Cổ Truyền,Học viện Y Dược học Cổ truyền Việt Nam
2953,9922,Trường THPT Phan Bội Châu-Cư Jut-Dak Nông,Trường THPT Phan Bội Châu
2954,9990,"Trường THPT nguyễn chí thanh , hòa thành , tây ninh .",Trường THPT Nguyễn Chí Thanh
2955,9026,CD CN VA KT OTO,Trường Cao Đẳng Công Nghệ Và Kỹ Thuật Ô Tô
2956,10589,Truong Trường THPT CS Tran Ngoc Hoang,Trường THCS-THPT Trần Ngọc Hoằng - H.Cờ Đỏ
2957,3470,trung tam gdtx phu cu,TT GDTX Phù Cừ
2958,14419,Trường Đại Học Y Hải Phòng,Trường Đại học Y Dược Hải Phòng
2959,11599,Trường THPT Tam Phú,Trường THPT Tam Phú
2960,10452,Đại Học Giao thông Vận Tải Cơ Sở 2 TPHCM,Phân hiệu Trường Đại học GTVT tại TP.HCM
2961,2814,tt dn gdtx huyen tram tau,TT DN-GDTX Huyện Trạm Tấu
2962,14076,Trường Kinh tế - Kỹ thuật An Giang,Trường Trung cấp Kinh tế - Kỹ thuật An Giang
2963,375,HUL,Đại học Luật TP.HCM
2964,8919,Trường THPT vân cốc -Phúc Thọ,Trường THPT Vân Cốc
2965,6378,Trường THPT phu tam,Trường THPT Phú Tâm
2966,14258,Hue Tuorism school,Trường Cao Đẳng Du Lịch Huế
2967,8031,KTH Royal Institute of Technology,Viện Công nghệ Hoàng gia
2968,1734,Trường THPT luong the vinh ba vi,Trường THPT Lương Thế Vinh-Ba Vì
2969,626,Đại Học Mở TPHCM,Đại Học Mở TP.HCM
2970,1973,Trường THPT nguyen khuyen,Trường THPT Nguyễn Khuyến
2971,6915,Trường THPT bavi,Trường THPT Ba Vì
2972,6428,truong Trường THCS-THPT tran van lam,Trường THCS-THPT Trần Văn Lắm
2973,2182,tt gdtx hai phong,TT GDTX Hải Phòng
2974,9931,Truong Trường THPT Châu Thành II,Trường THPT Châu Thành 2
2975,6020,Trường THPT vinh hoa hung bac,Trường THPT Vĩnh Hoà Hưng Bắc
2976,6099,tc nghe dong duong,TC Nghề Đông Dương
2977,3539,Trường THPT cong hoa,Trường THPT Cộng Hoà
2978,10454,Kinh te doi ngoai can tho,Trường Cao Đẳng Kinh tế Đối ngoại 
2979,8030,PTTH Tân Phú - Định Quán - Đồng Nai,Trường THPT Tân Phú
2980,14387,CD Luong Thuc Thuc Pham Da Nang,Trường Cao Đẳng Lương thực - Thực phẩm
2981,10730,Ha noi University of Industrial Fine Arts,Trường Đại học Mỹ thuật Công nghiệp
2982,12468,Trung hpt thai nguyen,Trường THPT Thái Nguyên
2983,3390,tt gdtx cam giang,TT GDTX Cẩm Giàng
2984,9640,Trường THCS-THPT Nguyễn Bỉnh Khiêm,Trường TH-THCS-THPT Nguyễn Bỉnh Khiêm
2985,2272,Trường THPT ngo quyen,Trường THPT Ngô Quyền
2986,2657,Trường THCS-THPT na phac,Trường THCS-THPT Nà Phặc
2987,7633,Trường THPT Trần Đại Nghĩa,Trường THPT Trần Đại Nghĩa
2988,14444,TT GDTX huyện phú lộc TTH,TT GDNN-GDTX Phú Lộc
2989,14397,Truong trung hoc Pho Thong Long Binh,Trường THPT Long Bình
2990,14439,Trường THPT Thuận Thành II,Trường THPT Thuận Thành 2
2991,4372,cd nghe so 23 bo quoc phong,CĐ Nghề số 23 Bộ Quốc phòng
2992,2768,Trường THPT nguyen hue,Trường THPT Nguyễn Huệ
2993,4538,truong cdn ky thuat cong nghe dung quat truong cao dang ky nghe dung quat,Trường CĐN Kỹ thuật - Công nghệ Dung Quất 
2994,4105,ttgdnn gdtx hung nguyen,TT GDNN-GDTX Hưng Nguyên
2995,631,Đại Học Nguyễn Tất Thành,Đại Học Nguyễn Tất Thành
2996,8877,Trường THPT Chu Van An-Quang Tri,Trường THPT Chu Văn An
2997,7944,Trường THCS Cẫm Xá,Trường THCS̉ Cẩm Xá
2998,14147,TT GDTX Quận 3,TT GDTX quận 3
2999,8813,TRuong dai thanh pho ben tre,PHÂN HIỆU ĐHQG-HCM TẠI TỈNH BẾN TRE
3000,4996,Trường THPT to van on,Trường THPT Tô Văn Ơn
3001,3173,tc nghe thu cong my nghe 19 5,TC Nghề Thủ công Mỹ nghệ 19.5
3002,7470,trung học phổ thông ái quốc,Trường THPT Ái Quốc
3003,3680,trung tam gdnn gdtx huyen nam truc,TT GDNN-GDTX huyện Nam Trực
3004,7184,pho thong muong cha,Trường THPT Mường Chà
3005,1259,cao dang nghe dak lak,Cao Đẳng KỸ THUẬT ĐẮK LẮK
3006,10298,Trường THCS-THPT khánh an,Trường THCS-THPT KHÁNH AN
3007,4066,Trường THPT do luong 3,Trường THPT Đô Lương 3
3008,3129,Trường THPT hoang hoa tham,Trường THPT Hoàng Hoa Thám
3009,11631,CNTT-DH Thai Nguyen,Trường Đại học Công nghệ Thông tin & Truyền thông Thái Nguyên
3010,14479,Trường THPT binh phux nhut,Trường THPT Bình Phục Nhứt
3011,920,truong dh san khau-dien anh ho chi minh,Đại học Sân khấu Điện ảnh TP.HCM
3012,6246,Trường THPT hieu phung,Trường THPT Hiếu Phụng
3013,5160,Trường THPT chu van an,Trường THPT Chu Văn An
3014,11182,Trường THPTth Đào Duy Từ thanh hóa,Trường THPT Đào Duy Từ
3015,465,PAPPV,Học Viện Chính Trị Công An Nhân Dân
3016,3431,Trường THPT nguyen trung ngan,Trường THPT Nguyễn Trung Ngạn
3017,136, SKDA,Đại Học Sân khấu – Điện Ảnh Hà Nội
3018,8037,Trường THPT Xuân Thọ,Trường THPT Xuân Thọ
3019,657,Đại Học Hà Tĩnh,Đại Học Hà Tĩnh
3020,485,Đại Học Thể Dục Thể Thao TPHCM,Đại Học Thể Dục Thể Thao TP.HCM
3021,10363,Truong Trường THPT huongkhe,Trường THPT HƯƠNG KHÊ
3022,8987,truong Cao Đẳng gtvt tphcm,Trường Cao Đẳng Giao Thông Vận Tải TP.HCM
3023,11440,Trường THPT Ngã Sáu,Trường THPT Ngã Sáu
3024,1844,pt nang khieu tdtt ha noi,Trường THPT Năng khiếu TDTT Hà Nội
3025,8751,Daj hoc lam ngjep,Trường Đại học Lâm nghiệp
3026,2444,Trường THPT dan toc noi tru ka lang,Trường THPT Dân tộc Nội trú Ka Lăng
3027,1879,Trường THPT trung vuong,Trường THPT Trưng Vương
3028,4273,tt gdtx le thuy,TT GDTX Lệ Thủy
3029,11793,Truơng trung hoc phô thông binh khanh cân giơ,Trường THPT Bình Khánh
3030,4772,tt gdnn gdtx chu pah,TT GDNN-GDTX Chư Păh
3031,11403,"Trường THPT Đoan Hùng, huyện Đoan Hùng, tỉnh Phú Thọ",Trường THPT Đoan Hùng
3032,10128,Truong trung cap Anh Sang,Trường Trung Cấp Ánh Sáng
3033,10432,Trường THPT Cù Chính Lan,Trường THPT Cù Chính Lan
3034,11759,Trường THPT Nguyễn Hiền,Trường THPT Nguyễn Hiền
3035,1489,dai hoc thai binh dtb,Đại học Thái Bình
3036,4601,truong Trường THPT luong the vinh tu 01 02 2020,Trường THPT Lương Thế Vinh
3037,142, Vietnam Trade Union University,Đại Học Công đoàn
